domain,company,title,url,crawled_at
cw,,嘉義市一日遊｜從車站出發吃火雞肉飯、東市場美食，在街頭和舊監獄遇見木都建築風景 - 微笑台灣,https://smiletaiwan.cw.com.tw/article/9056,2026-04-10 13:52:36
cw,,鄭習會上午11時登場！鄭麗文：兩岸敵對狀態一定要結束,https://www.cw.com.tw/article/5140557,2026-04-10 11:51:11
cw,,2026寵物用藥新制7月上路？對寵物看病、飼主買藥有何影響？關鍵QA一次看,https://www.cw.com.tw/article/5140560,2026-04-10 11:51:11
cw,,從3000個百寶箱訂戶到米其林餐廳 永豐餘生技董事長何奕佳，如何把有機變成好生意？,https://www.cw.com.tw/article/5140556,2026-04-10 11:51:11
cw,,「吸血鬼咬了梵谷」：從周杰倫〈太陽之子〉MV 看名畫轉譯，是翻玩藝術還是簡化經典？ - 換日線 Crossing,https://crossing.cw.com.tw/article/20658,2026-04-10 11:51:11
cw,,棄百萬年薪領最低時薪，只為離熱愛的咖啡更近：吳筱翎的「國際咖啡職人」之路｜張育誠／Robin & Fox Academy｜換日線 - 換日線 Crossing,https://crossing.cw.com.tw/article/20659,2026-04-10 11:51:11
cw,,他是值得我託付一生的人嗎？專家揭「5大指標」評估是否為適合伴侶,https://www.cw.com.tw/article/5140467,2026-04-10 08:01:28
cw,,荷姆茲海峽開了嗎？｜最醜CPI數據將現身？滯脹陰影全面壟罩,https://www.cw.com.tw/article/5140551,2026-04-10 07:09:08
cw,,能看懂IG內容的Meta AI，會讓你放棄ChatGPT嗎？Muse Spark全解析,https://www.cw.com.tw/article/5140549,2026-04-10 03:06:30
cw,,獨居老人不孤獨，24小時都有人的對講機｜投書 - 未來城市＠天下,https://futurecity.cw.com.tw/article/249?rec=i2i&from_id=3933&from_index=7,2026-04-10 01:37:08
cw,,【投書】那個讓球場爆滿的女人：從曼尼到李多慧，誰才是棒球場上的主角？｜郭芳彰／多元發聲．讀者投書 - 獨立評論@天下,https://opinion.cw.com.tw/blog/profile/52/article/17238,2026-04-10 01:37:08
cw,,「每個女人都可能成為鐵鍊女」：1.16 生育率背後，集體不安正重塑中國女性的未來｜馮哲芸（Emily Feng）／獨評讀好書 - 獨立評論@天下,https://opinion.cw.com.tw/blog/profile/390/article/17240,2026-04-10 01:37:08
cw,,【投書】新北校園暴力背後，被忽視的青少年人際求救訊號｜ 邱靖惠 ／ 多元發聲．讀者投書 - 獨立評論@天下,https://opinion.cw.com.tw/blog/profile/52/article/17241,2026-04-10 01:37:08
cw,,【投書】重返2026太平洋島國論壇！台灣能否擺脫美中角力，靠「海洋藍碳」換取外交影響？｜黃一展／多元發聲．讀者投書 - 獨立評論@天下,https://opinion.cw.com.tw/blog/profile/52/article/17242,2026-04-10 01:37:08
cw,,「即使過了50歲，也有可能是中二病」：邊緣人的冷門日劇《彈珠汽水猴子》 ｜ 米果／ 台北捌玖零 - 獨立評論@天下,https://opinion.cw.com.tw/blog/profile/57/article/17249,2026-04-10 01:37:08
cw,,伊朗幻象：失策的川普成為戰爭輸家,https://www.cw.com.tw/article/5140555,2026-04-10 00:01:27
cw,,台中漢神洲際4/10正式開幕！餐廳、熱門品牌、交通資訊一次看,https://www.cw.com.tw/article/5140553,2026-04-09 22:04:48
cw,,從英文老師到觀光金獎！她如何成為外國官員、高端客來台都指名的導遊？,https://www.cw.com.tw/article/5140554,2026-04-09 22:04:48
cw,,媽祖遶境想走完全程？醫師提醒：不只長輩要小心，這幾類「中年隱形族群」都要留意,https://www.cw.com.tw/article/5140552,2026-04-09 19:59:02
cw,,SDGs懶人包 - 未來城市＠天下 - 進步城市的新想像 - 未來城市＠天下,https://futurecity.cw.com.tw/article/837?rec=i2i&from_id=265&from_index=8,2026-04-09 18:58:51
cw,,軍火商、賭場、成人網站、菸酒大麻⋯⋯爭議產業怎麼做「永續」（ESG）？｜Jack I.C. Huang／The World 2.0｜換日線 - 換日線 Crossing,https://crossing.cw.com.tw/article/20657,2026-04-09 18:58:51
cw,,花蓮萬里溪畔的流轉歲月，看見摩里沙卡的林業故事、原客文化與轉型正義 - 微笑台灣,https://smiletaiwan.cw.com.tw/article/9038,2026-04-09 18:58:51
cw,,「鄭習會」前夕：鄭麗文罕有點名日本11次，能換來什麼？,https://www.cw.com.tw/article/5140539,2026-04-09 18:58:51
cw,,北市「缺公」全台第一：薪水付不起北漂生活，上班還要幫議員找論文資料,https://www.cw.com.tw/article/5140128,2026-04-09 17:49:14
cw,,百強企業正在退步？DEI評價首次出現關鍵下滑｜深度專題,https://www.cw.com.tw/feature/topic/2026DEIbrief,2026-04-09 17:49:14
cw,,金馬影后林嘉欣劈柴顧火，還留下燙傷傷痕 「做陶讓我樂於失敗」,https://www.cw.com.tw/index.php/article/5140537,2026-04-09 17:49:14
cw,,退休前必做3件事：避免晚年陷入「老、窮、孤單」窘境,https://www.cw.com.tw/article/5140513,2026-04-09 17:49:14
cw,,川普、伊朗停火兩週 聰明人怎麼看？,https://www.cw.com.tw/article/5140545,2026-04-09 17:49:14
cw,,哈佛職涯顧問：找工作最順遂的人，都做8件事,https://www.cw.com.tw/article/5140547,2026-04-09 17:49:14
cw,,不只有全台最大沙漠！到屏東滿州港仔村，探尋「叢林之眼」、黑潮漂來的匾額與民謠歌聲 - 微笑台灣,https://smiletaiwan.cw.com.tw/article/9031,2026-04-09 16:22:07
cw,,【AI助攻ESG】人工智慧不是大企業專利！為什麼中小企業更應該導入？ - CSR@天下,https://csr.cw.com.tw/article/44647,2026-04-09 16:22:07
cw,,誰說I人在職場就不吃香？5個內向者必學的「職場社交」小技巧,https://www.cw.com.tw/article/5140371,2026-04-09 16:22:07
cw,,愈長大愈感到孤獨？許瑋甯：我們都是生命的學徒，在痛苦與脆弱中成長,https://www.cw.com.tw/article/5140463,2026-04-09 16:22:07
cw,,台大退休教授的人生體悟：認老、學老，才能夠真正「樂老」,https://www.cw.com.tw/article/5140540,2026-04-09 16:22:07
cw,,捨棄公務鐵飯碗，他們選擇「漂」到偏鄉離島發展新人生！ ｜ 郭瓊瑩 ／ 郭瓊瑩 - 獨立評論@天下,https://opinion.cw.com.tw/blog/profile/263/article/17239,2026-04-09 16:22:07
cw,,我在美國職場「三年升遷兩次」：公開適合亞洲人的「循序漸進」向上管理法！ - 換日線 Crossing,https://crossing.cw.com.tw/article/20656,2026-04-09 16:22:07
cw,,在 30 歲前，辦一張通往世界的「神卡」：國際學生證（ISIC）申請與省錢全攻略 - 換日線 Crossing,https://crossing.cw.com.tw/article/20655,2026-04-09 16:22:07
cw,,夢想台灣的小瑞士 翁美珍：「苗栗也可以像瑞士一樣，成為台灣的後花園。」 - 微笑台灣,https://smiletaiwan.cw.com.tw/article/739,2026-04-09 14:57:23
cw,,未來城市＠天下｜2026年AI趨勢與企業AI應用決策指南 - 未來城市＠天下 - 進步城市的新想像 - 未來城市＠天下,https://futurecity.cw.com.tw/article/3967,2026-04-09 14:57:23
cw,,康寧股價翻3倍！矽光子、光通訊、先進封裝為什麼都需要它？台灣康寧總經理首度揭祕,https://www.cw.com.tw/article/5140499,2026-04-09 13:27:22
cw,,連新住民都不想做！為何公職會成為人人避之不及的惡夢？,https://www.cw.com.tw/article/5140472,2026-04-09 13:27:22
cw,,拆解百把老琴也不悔，彰化埔心「二胡琴人」40年淬鍊製琴心法，細節堆疊一門聲音工藝 - 微笑台灣,https://smiletaiwan.cw.com.tw/article/9036,2026-04-09 13:27:22
cw,,美伊可能停戰嗎？川普還會延後最後期限嗎？,https://www.cw.com.tw/article/5140501,2026-04-09 12:16:46
cw,,天下雜誌－華文世界最優質的財經雜誌,https://www.cw.com.tw/,2026-04-09 12:16:46
cw,,氣候署長蔡玲儀：酷齡行動示範調適策略，幫助獨居長者等脆弱族群應對高溫危機 - CSR@天下,https://csr.cw.com.tw/article/44639,2026-04-09 12:16:46
cw,,最新，川普同意停火兩週！有什麼前提？,https://www.cw.com.tw/article/5140509,2026-04-09 12:16:46
cw,,企業ESG社會面「S」怎麼做？KPMG新書提解方：從本業出發，打造三重盈餘永續商業模式 - 微笑台灣,https://smiletaiwan.cw.com.tw/article/9048,2026-04-09 12:16:46
cw,,百歲人生 有備而來論壇 | 南山人壽,https://event.cw.com.tw/2026nanshanlife/index.html,2026-04-09 12:16:46
cw,,台中石岡、新社二日遊｜循大甲溪走訪八寶圳與白冷圳，穿越地震記憶，遇見山城豐饒風景 - 微笑台灣,https://smiletaiwan.cw.com.tw/article/9049,2026-04-09 12:16:46
cw,,失控的心理治療：分析自己的想法，不一定對你有好處！ ｜ 喬．努奇（Joe Nucci） ／ 獨評讀好書 - 獨立評論@天下,https://opinion.cw.com.tw/blog/profile/390/article/17237,2026-04-09 12:16:46
cw,,高雄六龜湯旅春遊季｜徜徉花旗木粉紅花海、泡美人湯、走訪生態秘境與山林夜遊 - 微笑台灣,https://smiletaiwan.cw.com.tw/article/9042,2026-04-09 12:16:46
cw,,一間房子，分成兩個世界：囤積屋背後，是他們失序掙扎的人生｜ 羅靖茹 ／ 獨評讀好書 - 獨立評論@天下,https://opinion.cw.com.tw/blog/profile/390/article/17226,2026-04-09 12:16:46
cw,,碳強度變KPI業務超有感，王道銀行加強範疇三減碳力道 - CSR@天下,https://csr.cw.com.tw/esgaward/article/1092,2026-04-09 12:16:46
cw,,從淨零走向自然正值：崇越用一場旅程，讓永續成為日常 - CSR@天下,https://csr.cw.com.tw/esgaward/article/1076,2026-04-09 12:16:46
cw,,2026 Netflix價格、共享方案、怎麼用最划算？最新規則與常見問題一次看,https://www.cw.com.tw/article/5140534?rec=bak,2026-04-09 12:16:46
cw,,荷姆茲海峽風暴：伊朗戰爭如何影響你？每日追蹤：戰火下的能源、航運與價格震盪,https://www.cw.com.tw/graphics/iran-war-impact/,2026-04-09 12:16:46
cw,,攜手HOYA守護兒童視力健康,https://www.cw.com.tw/article/5140502,2026-04-09 12:16:46
cw,,救命與減碳並行，台北慈濟醫院翻轉醫療廢棄物 - CSR@天下,https://csr.cw.com.tw/esgaward/article/1160,2026-04-09 12:16:46
cw,,慈濟60載，用科技讓大愛更精準 - CSR@天下,https://csr.cw.com.tw/esgaward/article/1155,2026-04-09 12:16:46
cw,,從零開始的人才灌溉學：看臺中國家歌劇院如何打造生生不息的藝術人才生態系 - CSR@天下,https://csr.cw.com.tw/article/44641,2026-04-09 12:16:46
cw,,後山守護者「門諾醫院」，如何編織全人照護的永續網？ - CSR@天下,https://csr.cw.com.tw/esgaward/article/1162,2026-04-09 12:16:46
cw,,從灰色基石到綠色永續：嘉新水泥用科學與溫度重塑企業韌性 - CSR@天下,https://csr.cw.com.tw/esgaward/article/1137,2026-04-09 12:16:46
cw,,兆豐金控如何運用TNFD織就生態防護網？ - CSR@天下,https://csr.cw.com.tw/esgaward/article/1089,2026-04-09 12:16:46
cw,,為什麼聰明人反而賺不到錢？專家揭3個有效致富「笨方法」,https://www.cw.com.tw/article/5140392,2026-04-09 12:16:46
cw,,醫師提醒：「一大早喝咖啡」恐讓精神更疲憊，怎麼喝才正確？,https://www.cw.com.tw/article/5139968,2026-04-09 12:16:46
cw,,專家：一情境下，今年股市可能轉空頭,https://www.cw.com.tw/article/5140505,2026-04-09 12:16:46
cw,,一位父親給愛女的叮嚀：4個方式，判斷一段關係是否值得繼續,https://www.cw.com.tw/article/5140306,2026-04-09 12:16:46
cw,,LINE Premium怎麼訂閱？165元值得買嗎？付費功能有哪些？,https://www.cw.com.tw/article/5140491,2026-04-09 12:16:46
cw,,放棄工程師大好前途！他如何從不被看好，到實現機師夢想？,https://www.cw.com.tw/article/5139996,2026-04-09 12:16:46
cw,,「NO WAR！」直擊日本街頭，銀髮族如何靠靜默提醒「戰爭不該成為日常」｜睿安／讀者投書｜換日線 - 換日線 Crossing,https://crossing.cw.com.tw/article/20654,2026-04-09 12:16:46
cw,,我所看見的伊朗，跟新聞裡很不一樣（三）：在最孤立的國度裡，走進最溫暖的一個家｜張 J／旅行沙舟｜換日線 - 換日線 Crossing,https://crossing.cw.com.tw/article/20653,2026-04-09 12:16:46
cw,,中國隱形眼鏡品牌六折價，「他們抄襲速度很快」 晶碩、望隼怎麼轉型致勝？,https://www.cw.com.tw/article/5140529,2026-04-09 12:16:46
cw,,天下晨間新聞：美伊休戰藏地雷，市場先軋空再說，費半大漲6.3%,https://www.cw.com.tw/article/5140528,2026-04-09 12:16:46
cw,,島嶼食材偵探－豬舌舌根、咖哩混搭？從高雄左營「迪記法式豬舌飯」吃起，一解豬舌飲食學 - 微笑台灣,https://smiletaiwan.cw.com.tw/article/9037,2026-04-09 12:16:46
cw,,「強迫關機」的週末：為什麼在以色列，安息日是比「鐵穹」更強大的心靈防禦系統？ - 換日線 Crossing,https://crossing.cw.com.tw/article/20652,2026-04-09 12:16:46
cw,,啦啦隊助攻球場人氣，卻背「喧賓奪主」罵名？解析應援熱潮下被忽視的權益風險｜丁桀／史波特菲爾德｜換日線 - 換日線 Crossing,https://crossing.cw.com.tw/article/20650,2026-04-09 12:16:46
cw,,沙門氏菌是什麼？吃了會怎樣？新北「清六食堂」、高雄春捲食物中毒最新進況,https://www.cw.com.tw/article/5140533,2026-04-09 12:16:46
cw,,彭啟明：讓油價危機變民眾減塑契機，袋袋箱傳計畫媒合二手袋促進資源循環 - CSR@天下,https://csr.cw.com.tw/article/44643,2026-04-09 12:16:46
cw,,台中西屯、北屯一日遊｜漫遊綠美圖與公園草地，喝鳳梨冰滴咖啡、散步四張犁文化街區 - 微笑台灣,https://smiletaiwan.cw.com.tw/article/9043,2026-04-09 12:16:46
cw,,伊朗文明毀滅90分鐘倒數，北京出手攔下戰爭？陰陽版本提案鬧場，接下來會怎樣？,https://www.cw.com.tw/article/5140530,2026-04-09 12:16:46
cw,,《換日線》2026 主題徵稿「AI 時代，我這樣學＿＿」活動辦法 - 換日線 Crossing,https://crossing.cw.com.tw/article/20651,2026-04-09 12:16:46
cw,,減碳量可達2000座大安森林公園！AI助攻ESG，把永續思維融入企業治理 - CSR@天下,https://csr.cw.com.tw/article/44644,2026-04-09 12:16:46
cw,,辜仲諒砸百億入主台泥成最大股東，分家24年後再度合體？,https://www.cw.com.tw/article/5140531,2026-04-09 12:16:46
cw,,【AI助攻ESG】不只優化報告書！高碳排產業如何用AI節能減碳？ - CSR@天下,https://csr.cw.com.tw/article/44637,2026-04-09 12:16:46
cw,,感動也能被設計：兩廳院的智慧物聯網劇場奇想 - 未來城市＠天下,https://futurecity.cw.com.tw/article/3959,2026-04-09 12:16:46
cw,,Labubu、Jellycat可愛商機哪裡來？7個國家、4500份問卷揭開AI無法生成的創意祕密,https://www.cw.com.tw/article/5140526,2026-04-09 12:16:46
cw,,川普停火宣言神救援，日圓躲過「200」崩盤劇本,https://www.cw.com.tw/article/5140518,2026-04-09 12:16:46
cw,,AI巨頭為何用千萬年薪擴大招「文組人才」？,https://www.cw.com.tw/article/5140520,2026-04-09 12:16:46
cw,,吳淡如：通膨時代退休金「千萬別抓剛好」，怎麼抓才保險？,https://www.cw.com.tw/article/5140465,2026-04-09 12:16:46
cw,,從留不住人到離職率僅3%！橘色涮涮屋如何打破餐飲缺工魔咒？,https://www.cw.com.tw/article/5140356,2026-04-09 12:16:46
cw,,美伊拖延戰，台股、美股、黃金怎麼買？投資人Q2資產重配置指南,https://www.cw.com.tw/article/5140511,2026-04-09 12:16:46
cw,,在金澤居酒屋品一杯「Kiss of Fire」，試探曖昧關係的界線,https://www.cw.com.tw/article/5140345,2026-04-09 12:16:46
