domain,company,title,url,crawled_at
economictimes,,AI startup Nava raises $22 million in round led by Greenoaks Capital,https://economictimes.indiatimes.com/tech/funding/ai-startup-nava-raises-22-million-in-round-led-by-greenoaks-capital/articleshow/130120363.cms,2026-04-09 10:24:02
economictimes,,Costly raw materials weigh heavy on D2C luggage companies,https://economictimes.indiatimes.com/tech/funding/costly-raw-materials-weigh-heavy-on-d2c-luggage-companies/articleshow/130120200.cms,2026-04-09 10:24:02
economictimes,,Costly raw materials weigh heavy on D2C luggage companies,https://economictimes.indiatimes.com/tech/startups/costly-raw-materials-weigh-heavy-on-d2c-luggage-companies/articleshow/130120199.cms,2026-04-09 10:24:02
economictimes,,ETtech Explainer: Why Anthropic’s new AI model Mythos is a moment of reckoning,https://economictimes.indiatimes.com/tech/artificial-intelligence/ettech-explainer-why-anthropics-new-ai-model-mythos-is-a-moment-of-reckoning/articleshow/130120144.cms,2026-04-09 10:24:02
economictimes,,"PE-backed IT companies growing faster, thanks to costs control, ops shifts, say experts",https://economictimes.indiatimes.com/tech/information-tech/pe-backed-it-companies-growing-faster-thanks-to-costs-control-ops-shifts-say-experts/articleshow/130120049.cms,2026-04-09 10:24:02
economictimes,,"SpiceJet desperately hunts for lifeline, starts job cuts",https://economictimes.indiatimes.com/prime/transportation/spicejet-hunts-for-lifeline-once-more-amid-staff-cuts-delayed-pay/primearticleshow/130106357.cms,2026-04-09 07:59:44
economictimes,,"Time to be contrarian, but with one condition: 5 mid-cap stocks from different sectors with an upside potential up to 32%",https://economictimes.indiatimes.com/markets/stocks/news/time-to-be-contrarian-but-with-one-condition-5-mid-cap-stocks-from-different-sectors-with-an-upside-potential-up-to-32/articleshow/130092247.cms,2026-04-09 07:59:44
economictimes,,"These 8 private and public banking stocks have an upside of up to 28% in one year, according to analysts",https://economictimes.indiatimes.com/markets/stocks/news/these-8-private-and-public-banking-stocks-have-an-upside-of-up-to-28-in-one-year-according-to-analysts/articleshow/130099572.cms,2026-04-09 07:59:44
economictimes,,"These mid-cap stocks with ‘Strong Buy’ &amp;amp; ‘Buy’ recos can rally over 25%, according to analysts",https://economictimes.indiatimes.com/markets/stocks/news/these-mid-cap-stocks-with-strong-buy-buy-recos-can-rally-over-25-according-to-analysts/articleshow/130118384.cms,2026-04-09 07:59:44
economictimes,,Citigroup says AI helps speed account openings and systems upgrades,https://economictimes.indiatimes.com/tech/artificial-intelligence/citigroup-says-ai-helps-speed-account-openings-and-systems-upgrades/articleshow/130120945.cms,2026-04-09 03:15:17
economictimes,,Latest Anthropic AI model finds cracks in software defenses,https://economictimes.indiatimes.com/tech/artificial-intelligence/latest-anthropic-ai-model-finds-cracks-in-software-defenses/articleshow/130120454.cms,2026-04-09 01:40:27
economictimes,,Six investors buy 1.6% stake in Delhivery for Rs 530 crore; Nexus Venture Partners sells stake,https://economictimes.indiatimes.com/tech/technology/six-investors-buy-1-6-stake-in-delhivery-for-rs-530-crore-nexus-venture-partners-sells-stake/articleshow/130119936.cms,2026-04-09 01:40:27
economictimes,,Marc Andreessen sketches AGI pricing for advanced AI systems like OpenClaw,https://economictimes.indiatimes.com/tech/artificial-intelligence/marc-andreessen-sketches-agi-pricing-for-advanced-ai-systems-like-openclaw/articleshow/130119540.cms,2026-04-09 01:40:27
economictimes,,"Cyient Semiconductor acquires Kinetic Technologies, eyes data center market",https://economictimes.indiatimes.com/tech/technology/cyient-semiconductor-acquires-kinetic-technologies-eyes-data-center-market/articleshow/130119303.cms,2026-04-09 01:40:27
economictimes,,Meta unveils first AI model from superintelligence team,https://economictimes.indiatimes.com/tech/artificial-intelligence/meta-unveils-first-ai-model-from-superintelligence-team/articleshow/130118966.cms,2026-04-09 01:40:27
economictimes,,D2C farm produce platform Pluckk raises Rs 100 crore from Euro Gulf Investment,https://economictimes.indiatimes.com/tech/funding/d2c-farm-produce-platform-pluckk-raises-rs-100-crore-from-euro-gulf-investment/articleshow/130118770.cms,2026-04-09 01:40:27
economictimes,,Karnataka reviews global outreach push to boost startup market access,https://economictimes.indiatimes.com/tech/startups/karnataka-reviews-global-outreach-push-to-boost-startup-market-access/articleshow/130117376.cms,2026-04-09 00:14:29
economictimes,,OpenAI rejects Elon Musk’s ‘eleventh-hour’ filing demanding Sam Altman’s ouster,https://economictimes.indiatimes.com/tech/artificial-intelligence/openai-rejects-elon-musks-eleventh-hour-filing-demanding-sam-altmans-ouster/articleshow/130117120.cms,2026-04-09 00:14:29
economictimes,,Deloitte launches quantum tech facility at IIT Bombay,https://economictimes.indiatimes.com/tech/technology/deloitte-launches-quantum-tech-facility-at-iit-bombay/articleshow/130116973.cms,2026-04-08 22:53:21
economictimes,,Indian tech startups' funding declines 18% to $11.7 billion in FY26: Tracxn,https://economictimes.indiatimes.com/tech/funding/indian-tech-startups-funding-declines-18-to-usd-11-7-billion-in-fy26-tracxn/articleshow/130115932.cms,2026-04-08 22:53:21
economictimes,,IT mojo returns pre-Q4 results; Flipkart's AI sprint,https://economictimes.indiatimes.com/tech/newsletters/tech-top-5/it-mojo-returns-pre-q4-results-flipkarts-ai-sprint/articleshow/130114780.cms,2026-04-08 22:53:21
economictimes,,"Unity, Meta extend multi‑year partnership to power next‑generation VR experiences",https://economictimes.indiatimes.com/tech/technology/unity-meta-extend-multiyear-partnership-to-power-nextgeneration-vr-experiences/articleshow/130115271.cms,2026-04-08 22:53:21
economictimes,,"Anthropic appoints Amlan Mohanty to lead India policy, external affairs",https://economictimes.indiatimes.com/tech/artificial-intelligence/anthropic-appoints-amlan-mohanty-to-lead-india-policy-external-affairs/articleshow/130115108.cms,2026-04-08 22:53:21
economictimes,,ClayCo raises nearly Rs 35 crore in funding round,https://economictimes.indiatimes.com/tech/funding/clayco-raises-nearly-rs-35-crore-in-funding-round/articleshow/130113372.cms,2026-04-08 21:19:59
economictimes,,Drone manufacturing startup BonV Aero commences work on Rs 300 crore UAV facility in Odisha,https://economictimes.indiatimes.com/tech/startups/drone-manufacturing-startup-bonv-aero-commences-work-on-rs-300-crore-uav-facility-in-odisha/articleshow/130113370.cms,2026-04-08 21:19:59
economictimes,,Researchers unmask trade in nude images on Telegram,https://economictimes.indiatimes.com/tech/technology/researchers-unmask-trade-in-nude-images-on-telegram/articleshow/130113351.cms,2026-04-08 21:19:59
economictimes,,How the math works on a $1.75 trillion SpaceX valuation,https://economictimes.indiatimes.com/tech/technology/how-the-math-works-on-a-1-75-trillion-spacex-valuation/articleshow/130113338.cms,2026-04-08 21:19:59
economictimes,,"Russia sees China's WeChat, Douyin as models for its homegrown Max messenger",https://economictimes.indiatimes.com/tech/technology/russia-sees-chinas-wechat-douyin-as-models-for-its-homegrown-max-messenger/articleshow/130113266.cms,2026-04-08 21:19:59
economictimes,,India venture debt deployment grows marginally in 2025 to $1.3 billion: Report,https://economictimes.indiatimes.com/tech/funding/india-venture-debt-deployment-grows-marginally-in-2025-to-1-3-billion-report/articleshow/130112244.cms,2026-04-08 21:19:59
economictimes,,Flipkart expands Hemant Badri’s role to drive AI agenda,https://economictimes.indiatimes.com/tech/technology/flipkart-expands-hemant-badris-role-to-drive-ai-agenda/articleshow/130110798.cms,2026-04-08 19:30:44
economictimes,,"Grab to lean on scale, AI to navigate rising fuel costs, CEO says",https://economictimes.indiatimes.com/tech/startups/grab-to-lean-on-scale-ai-to-navigate-rising-fuel-costs-ceo-says/articleshow/130110266.cms,2026-04-08 19:30:44
economictimes,,Visa processing startup Atlys announces Esop buyback worth Rs 4 crore,https://economictimes.indiatimes.com/tech/startups/visa-processing-startup-atlys-announces-esop-buyback-worth-rs-4-crore/articleshow/130109950.cms,2026-04-08 19:30:44
economictimes,,Swiss banks to test possible uses for Swiss franc stablecoin,https://economictimes.indiatimes.com/tech/technology/swiss-banks-to-test-possible-uses-for-swiss-franc-stablecoin/articleshow/130109963.cms,2026-04-08 19:30:44
economictimes,,China's Sigenergy Technology aims to raise $562 million in Hong Kong IPO,https://economictimes.indiatimes.com/tech/technology/chinas-sigenergy-technology-aims-to-raise-562-million-in-hong-kong-ipo/articleshow/130109807.cms,2026-04-08 19:30:44
economictimes,,"Super Micro begins independent probe after criminal case against cofounder, others",https://economictimes.indiatimes.com/tech/technology/super-micro-begins-independent-probe-after-criminal-case-against-cofounder-others/articleshow/130109657.cms,2026-04-08 19:30:44
economictimes,,RBI policy: Why high inflation estimates don't mean higher rates,https://economictimes.indiatimes.com/prime/fintech-and-bfsi/rbi-policy-why-high-inflation-estimates-dont-mean-higher-rates/primearticleshow/130107905.cms,2026-04-08 18:08:18
economictimes,,"Perplexity’s revenue has shot up 50% in one month, amid shift in focus to AI agents: FT",https://economictimes.indiatimes.com/tech/artificial-intelligence/perplexitys-revenue-has-shot-up-50-in-one-month-amid-shift-in-focus-to-ai-agents-ft/articleshow/130107855.cms,2026-04-08 18:08:18
economictimes,,Prometheus bound: Why xAI cofounder and former OpenAI hand Kyle Kosic is heading to Jeff Bezos’ AI venture,https://economictimes.indiatimes.com/tech/artificial-intelligence/prometheus-bound-why-xai-cofounder-and-former-openai-hand-kyle-kosic-is-heading-to-jeff-bezos-ai-venture/articleshow/130106170.cms,2026-04-08 16:42:15
economictimes,,Greece expected to announce social media ban for children under 15,https://economictimes.indiatimes.com/tech/technology/greece-expected-to-announce-social-media-ban-for-children-under-15/articleshow/130105289.cms,2026-04-08 15:19:25
economictimes,,Anthropic ropes in Microsoft executive Eric Boyd to lead infrastructure,https://economictimes.indiatimes.com/tech/artificial-intelligence/anthropic-ropes-in-microsoft-executive-eric-boyd-to-lead-infrastructure/articleshow/130102051.cms,2026-04-08 13:44:10
economictimes,,TikTok to build a second billion-euro data centre in Finland,https://economictimes.indiatimes.com/tech/technology/tiktok-to-build-a-second-billion-euro-data-centre-in-finland/articleshow/130100856.cms,2026-04-08 11:39:26
economictimes,,Co-branded cards squeeze; Slice’s valuation reset,https://economictimes.indiatimes.com/tech/newsletters/morning-dispatch/co-branded-cards-squeeze-slices-valuation-reset/articleshow/130099735.cms,2026-04-08 10:09:10
economictimes,,Rocket soars beyond vibecoding to offer enterprise solutions,https://economictimes.indiatimes.com/tech/startups/rocket-soars-beyond-vibecoding-to-offer-enterprise-solutions/articleshow/130094882.cms,2026-04-08 08:53:32
economictimes,,"West Asia conflict fears could harden credit card underwriting, curb co-branded card growth",https://economictimes.indiatimes.com/tech/startups/west-asia-conflict-fears-could-harden-credit-card-underwriting-curb-co-branded-card-growth/articleshow/130094604.cms,2026-04-08 08:53:32
economictimes,,Exotel acqui-hires Dubverse core team in voice AI push,https://economictimes.indiatimes.com/tech/startups/exotel-acqui-hires-dubverse-core-team-in-voice-ai-push/articleshow/130092860.cms,2026-04-08 08:53:32
economictimes,,"Indian startups productive with AI, but revenue impact yet to be seen: Report",https://economictimes.indiatimes.com/tech/artificial-intelligence/indian-startups-productive-with-ai-but-revenue-impact-yet-to-be-seen-report/articleshow/130092667.cms,2026-04-08 08:53:32
economictimes,,"Indian startups productive with AI, but revenue impact yet to be seen: Report",https://economictimes.indiatimes.com/tech/startups/indian-startups-productive-with-ai-but-revenue-impact-yet-to-be-seen-report/articleshow/130092630.cms,2026-04-08 08:53:32
economictimes,,"Accounting tech startup Atlas raises $6 million in round co-led by Accel, Stellaris",https://economictimes.indiatimes.com/tech/funding/accounting-tech-startup-atlas-raises-6-million-in-round-co-led-by-accel-stellaris/articleshow/130092598.cms,2026-04-08 08:53:32
economictimes,,Slice in talks to raise $50-100 million at a valuation cut as it sharpens digital bank pitch,https://economictimes.indiatimes.com/tech/funding/slice-in-talks-to-raise-50-100-million-at-a-valuation-cut-as-it-sharpens-digital-bank-pitch/articleshow/130091764.cms,2026-04-08 08:53:32
economictimes,,Slice in talks to raise $50-100 million at a valuation cut as it sharpens digital bank pitch,https://economictimes.indiatimes.com/tech/startups/slice-in-talks-to-raise-50-100-million-at-a-valuation-cut-as-it-sharpens-digital-bank-pitch/articleshow/130091738.cms,2026-04-08 08:53:32
economictimes,,"Kreditbee secures $280 million funding, joins unicorn club with $1.5 billion valuation",https://economictimes.indiatimes.com/tech/startups/kreditbee-secures-280-million-funding-joins-unicorn-club-with-1-5-billion-valuation/articleshow/130091265.cms,2026-04-08 08:53:32
economictimes,,Digital lender Kreditbee in unicorn club with $280 million at $1.5 billion valuation,https://economictimes.indiatimes.com/tech/funding/kreditbee-secures-280-million-funding-joins-unicorn-club-with-1-5-billion-valuation/articleshow/130091264.cms,2026-04-08 08:53:32
economictimes,,How the promised gains from ethanol blending of petrol evaporated,https://economictimes.indiatimes.com/prime/energy/how-the-promised-gains-from-ethanol-blending-of-petrol-evaporated/primearticleshow/130084289.cms,2026-04-08 08:02:50
economictimes,,These large-caps have ‘strong buy’ &amp;amp; ‘buy’ recos and an upside potential of up to 25%,https://economictimes.indiatimes.com/markets/stocks/news/these-large-caps-have-strong-buy-buy-recos-and-an-upside-potential-of-up-to-25/articleshow/130073447.cms,2026-04-08 08:02:50
economictimes,,"Buy, Sell or Hold? Morgan Stanley maintains Equal Weight on Godrej Consumer; Goldman Sachs retains buy on Maruti Suzuki",https://economictimes.indiatimes.com/markets/stocks/news/buy-sell-or-hold-morgan-stanley-maintains-equal-weight-on-godrej-consumer-goldman-sachs-retains-buy-on-maruti-suzuki/articleshow/130077084.cms,2026-04-08 08:02:50
economictimes,,Anthropic touts AI cybersecurity project with Big Tech partners,https://economictimes.indiatimes.com/tech/technology/anthropic-touts-ai-cybersecurity-project-with-big-tech-partners/articleshow/130095433.cms,2026-04-08 03:03:36
economictimes,,"Adobe debuts AI Student Spaces on Acrobat; enables podcasts, videos from study material",https://economictimes.indiatimes.com/tech/artificial-intelligence/adobe-debuts-ai-student-spaces-on-acrobat-enables-podcasts-videos-from-study-material/articleshow/130092626.cms,2026-04-08 01:33:18
economictimes,,"IT rule tweaks only clarificatory, don't expand govt power: MeitY Secretary",https://economictimes.indiatimes.com/tech/technology/it-rule-tweaks-only-clarificatory-dont-expand-govt-power-meity-secretary/articleshow/130092109.cms,2026-04-08 01:33:18
economictimes,,D2C air conditioner startup Helium raises $2 million from India Quotient,https://economictimes.indiatimes.com/tech/funding/d2c-air-conditioner-startup-helium-raises-2-million-from-india-quotient/articleshow/130091316.cms,2026-04-08 00:10:04
economictimes,,"Karnataka eyes deeptech push, expansion beyond Bengaluru to drive next startup wave",https://economictimes.indiatimes.com/tech/startups/karnataka-eyes-deeptech-push-expansion-beyond-bengaluru-to-drive-next-startup-wave/articleshow/130090188.cms,2026-04-08 00:10:04
economictimes,,Digital commerce in India will grow to $250 billion by 2030: Google and Deloitte report,https://economictimes.indiatimes.com/tech/startups/digital-commerce-in-india-will-grow-to-250-billion-by-2030-google-and-deloitte-report/articleshow/130089492.cms,2026-04-07 22:53:33
economictimes,,Uber bets on Amazon's custom chips to boost AI efforts,https://economictimes.indiatimes.com/tech/artificial-intelligence/uber-bets-on-amazons-custom-chips-to-boost-ai-efforts/articleshow/130089420.cms,2026-04-07 22:53:33
economictimes,,Google adds Gemini crisis features amid lawsuit over user's suicide,https://economictimes.indiatimes.com/tech/technology/google-adds-gemini-crisis-features-amid-lawsuit-over-users-suicide/articleshow/130089089.cms,2026-04-07 22:53:33
economictimes,,Fox to integrate Kalshi prediction market data across news platforms,https://economictimes.indiatimes.com/tech/technology/fox-to-integrate-kalshi-prediction-market-data-across-news-platforms/articleshow/130089201.cms,2026-04-07 22:53:33
economictimes,,"Intel joins Musk's Terafab AI chip project to power humanoid, data centre goals",https://economictimes.indiatimes.com/tech/artificial-intelligence/intel-to-join-the-terafab-project-with-spacex-xai-and-tesla/articleshow/130088476.cms,2026-04-07 22:53:33
economictimes,,Amazon's Now pivot; Anthropic's revenue surge,https://economictimes.indiatimes.com/tech/newsletters/tech-top-5/amazon-now-pivot-anthropics-revenue-surge/articleshow/130088027.cms,2026-04-07 22:53:33
economictimes,,"MeitY meets intermediaries, civil society groups on draft IT rule changes; says govt open to suggestions",https://economictimes.indiatimes.com/tech/technology/meity-meets-intermediaries-civil-society-groups-on-draft-it-rule-changes-says-govt-open-to-suggestions/articleshow/130088233.cms,2026-04-07 22:53:33
economictimes,,India's first driverless pod taxi system to decongest BKC in Mumbai,https://economictimes.indiatimes.com/tech/technology/indias-first-driverless-pod-taxi-system-to-decongest-bkc-in-mumbai/articleshow/130087712.cms,2026-04-07 21:18:44
economictimes,,AI infra startup WorkOnGrid raises Rs 22.5 crore led by Transition Venture Capital,https://economictimes.indiatimes.com/tech/funding/ai-infra-startup-workongrid-raises-rs-22-5-crore-led-by-transition-venture-capital/articleshow/130087854.cms,2026-04-07 21:18:44
economictimes,,Silicon Valley’s hottest AI metric is also its least trusted,https://economictimes.indiatimes.com/tech/artificial-intelligence/silicon-valleys-hottest-ai-metric-is-also-its-least-trusted/articleshow/130087588.cms,2026-04-07 21:18:44
economictimes,,Enterprise AI startup Xccelera raises Rs 1.2 crore,https://economictimes.indiatimes.com/tech/funding/enterprise-ai-startup-xccelera-raises-rs-1-2-crore/articleshow/130086979.cms,2026-04-07 21:18:44
economictimes,,AI networking firm Aria Networks raises $125 million in funding,https://economictimes.indiatimes.com/tech/technology/ai-networking-firm-aria-networks-raises-125-million-in-funding/articleshow/130085963.cms,2026-04-07 21:18:44
economictimes,,Kirana stores see dip in business as consumers shift to quick commerce: Report,https://economictimes.indiatimes.com/tech/technology/kirana-stores-see-dip-in-business-as-consumers-shift-to-quick-commerce-report/articleshow/130085941.cms,2026-04-07 21:18:44
economictimes,,Bill Ackman's Pershing Square proposes $64 billion merger deal with Universal Music Group,https://economictimes.indiatimes.com/tech/technology/bill-ackmans-pershing-square-proposes-64-billion-merger-deal-with-universal-music-group/articleshow/130085215.cms,2026-04-07 21:18:44
economictimes,,"Depressed tech valuations could offer entry point for investors, Goldman Sachs says",https://economictimes.indiatimes.com/tech/technology/depressed-tech-valuations-could-offer-entry-point-for-investors-goldman-sachs-says/articleshow/130084985.cms,2026-04-07 19:54:14
economictimes,,Cred widens mutual fund app Kuvera’s ambit for bigger wealth management play,https://economictimes.indiatimes.com/tech/technology/cred-widens-mutual-fund-app-kuveras-ambit-for-bigger-wealth-management-play/articleshow/130082000.cms,2026-04-07 18:42:55
economictimes,,Boat cofounder Aman Gupta's Offbeat Studios raises Rs 100 crore led by Bessemer Venture Partners,https://economictimes.indiatimes.com/tech/funding/boat-cofounder-aman-guptas-offbeat-studios-raises-rs-100-crore-in-funding-led-by-bessemer-venture-partners/articleshow/130081590.cms,2026-04-07 18:42:55
economictimes,,Clean energy startup Ecoil raises $2.5 million in round led by Fundalogical Ventures,https://economictimes.indiatimes.com/tech/funding/clean-energy-startup-ecoil-raises-2-5-million-in-round-led-by-fundalogical-ventures/articleshow/130079818.cms,2026-04-07 15:56:44
economictimes,,Vietnam's MoMo weighs options including new investors at valuation above $2 billion,https://economictimes.indiatimes.com/tech/technology/vietnams-momo-weighs-options-including-new-investors-at-valuation-above-2-billion/articleshow/130079164.cms,2026-04-07 15:56:44
economictimes,,Meta to release open source versions of its upcoming AI models,https://economictimes.indiatimes.com/tech/artificial-intelligence/meta-to-release-open-source-versions-of-its-upcoming-ai-models/articleshow/130078640.cms,2026-04-07 15:56:44
economictimes,,"Four-day week, taxes on robots, public wealth fund: OpenAI floats policy ideas for the intelligence age",https://economictimes.indiatimes.com/tech/artificial-intelligence/four-day-week-taxes-on-robots-public-wealth-fund-openai-floats-policy-ideas-for-the-intelligence-age/articleshow/130077855.cms,2026-04-07 14:22:01
economictimes,,"China targets Taiwan's chip prowess to evade global 'containment', Taipei government says",https://economictimes.indiatimes.com/tech/technology/china-targets-taiwans-chip-prowess-to-evade-global-containment-taipei-government-says/articleshow/130075380.cms,2026-04-07 12:58:26
economictimes,,"Apple's foldable iPhone faces engineering snags, potential shipment delays: Nikkei Asia",https://economictimes.indiatimes.com/tech/technology/apples-foldable-iphone-faces-engineering-snags-potential-shipment-delays-nikkei-asia/articleshow/130075227.cms,2026-04-07 12:58:26
economictimes,,AI-generated artists break through in country music,https://economictimes.indiatimes.com/tech/artificial-intelligence/ai-generated-artists-break-through-in-country-music/articleshow/130074895.cms,2026-04-07 12:58:26
economictimes,,Australia's Firmus raises $505 million to expand AI infrastructure across Asia-Pacific,https://economictimes.indiatimes.com/tech/funding/australias-firmus-raises-505-million-to-expand-ai-infrastructure-across-asia-pacific/articleshow/130074841.cms,2026-04-07 12:58:26
economictimes,,"SpaceX lays out IPO details, targets early June roadshow",https://economictimes.indiatimes.com/tech/technology/spacex-lays-out-ipo-details-targets-early-june-roadshow/articleshow/130074203.cms,2026-04-07 12:58:26
economictimes,,Tech job openings fall 8% in April as AI replaces headcount,https://economictimes.indiatimes.com/tech/technology/tech-hiring-in-india-falls-8-in-april-as-ai-replaces-headcount/articleshow/130066549.cms,2026-04-07 12:58:26
economictimes,,"Why retail investors love Infy, HDFC Bank despite meagre returns",https://economictimes.indiatimes.com/prime/money-and-markets/why-retail-investors-love-infy-hdfc-bank-despite-meagre-returns/primearticleshow/130058767.cms,2026-04-07 10:24:12
economictimes,,Will the coming earnings season(s) ring in more trouble for India Inc and investors?,https://economictimes.indiatimes.com/markets/stocks/news/will-the-coming-earnings-seasons-ring-in-more-trouble-for-india-inc-and-investors/articleshow/130057017.cms,2026-04-07 10:24:12
economictimes,,Stock picks of the week: 5 stocks with consistent score improvement and upside potential of up to 29%,https://economictimes.indiatimes.com/markets/stocks/news/stock-picks-of-the-week-5-stocks-with-consistent-score-improvement-and-upside-potential-of-up-to-29/articleshow/130055138.cms,2026-04-07 10:24:12
economictimes,,Nvidia acquisition of SchedMD sparks worry among AI specialists about software access,https://economictimes.indiatimes.com/tech/technology/nvidia-acquisition-of-schedmd-sparks-worry-among-ai-specialists-about-software-access/articleshow/130073752.cms,2026-04-07 10:24:12
economictimes,,"Anthropic tops $30 billion run rate, seals deal with Broadcom",https://economictimes.indiatimes.com/tech/artificial-intelligence/anthropic-tops-30-billion-run-rate-seals-deal-with-broadcom/articleshow/130073830.cms,2026-04-07 10:24:12
economictimes,,"OpenAI, Anthropic, Google unite to combat model copying in China",https://economictimes.indiatimes.com/tech/artificial-intelligence/openai-anthropic-google-unite-to-combat-model-copying-in-china/articleshow/130073787.cms,2026-04-07 10:24:12
economictimes,,Netflix debuts new Playground gaming app for kids,https://economictimes.indiatimes.com/tech/technology/netflix-debuts-new-playground-gaming-app-for-kids/articleshow/130073533.cms,2026-04-07 10:24:12
economictimes,,India's tech hiring chills; Polymarket's IPL bet,https://economictimes.indiatimes.com/tech/newsletters/morning-dispatch/indias-tech-hiring-chills-polymarkets-ipl-bet/articleshow/130073372.cms,2026-04-07 10:24:12
economictimes,,How you can get started with AI agents… and get your life back,https://economictimes.indiatimes.com/tech/artificial-intelligence/how-you-can-get-started-with-ai-agents-and-get-your-life-back/articleshow/130068021.cms,2026-04-07 10:24:12
economictimes,,ET Graphics: Future of search is on fast track,https://economictimes.indiatimes.com/tech/artificial-intelligence/et-graphics-future-of-search-is-on-fast-track/articleshow/130067614.cms,2026-04-07 10:24:12
