domain,company,title,url,crawled_at
economictimes,,AI’s defence push raises alarm bells at top enterprises,https://economictimes.indiatimes.com/tech/artificial-intelligence/ais-defence-push-raises-alarm-bells-at-top-enterprises/articleshow/130067575.cms,2026-04-07 10:24:12
economictimes,,Firms take on AI chatbots in visibility fight,https://economictimes.indiatimes.com/tech/artificial-intelligence/firms-take-on-ai-chatbots-in-visibility-fight/articleshow/130067348.cms,2026-04-07 10:24:12
economictimes,,US prediction market players make a play for Indian IPL fans,https://economictimes.indiatimes.com/tech/startups/us-prediction-market-players-make-a-play-for-indian-ipl-fans/articleshow/130067344.cms,2026-04-07 10:24:12
economictimes,,"Nandan Nilekani, Pramod Varma eye AI-led global rails for commerce in next leap",https://economictimes.indiatimes.com/tech/technology/nilekani-varma-eye-ai-led-global-rails-for-commerce-in-next-leap/articleshow/130066767.cms,2026-04-07 10:24:12
economictimes,,Tech firms take foot off hiring pedal at AI turn,https://economictimes.indiatimes.com/tech/technology/tech-firms-take-foot-off-hiring-pedal-on-ai-turn/articleshow/130066549.cms,2026-04-07 10:24:12
economictimes,,Amazon strikes deal with USPS that maintains 80% of package volume,https://economictimes.indiatimes.com/tech/technology/amazon-strikes-deal-with-usps-that-maintains-80-of-package-volume/articleshow/130073354.cms,2026-04-07 10:24:12
economictimes,,Broadcom signs long-term deal to develop Google's custom AI chips,https://economictimes.indiatimes.com/tech/artificial-intelligence/broadcom-signs-long-term-deal-to-develop-googles-custom-ai-chips/articleshow/130073330.cms,2026-04-07 10:24:12
economictimes,,"OpenAI urges California, Delaware to investigate Musk's 'anti-competitive behaviour'",https://economictimes.indiatimes.com/tech/technology/openai-urges-california-delaware-to-investigate-musks-anti-competitive-behaviour/articleshow/130073328.cms,2026-04-07 10:24:12
economictimes,,Samsung flags eightfold jump in Q1 profit as AI chip demand drives up prices,https://economictimes.indiatimes.com/tech/technology/samsung-flags-eightfold-jump-in-q1-profit-as-ai-chip-demand-drives-up-prices/articleshow/130073317.cms,2026-04-07 10:24:12
economictimes,,"Pine Labs’ Navin Chandani steps down as president, CBO of issuing business",https://economictimes.indiatimes.com/tech/technology/pine-labs-navin-chandani-steps-down-as-president-cbo-of-issuing-business/articleshow/130067020.cms,2026-04-07 01:43:47
economictimes,,Wipro steps up dealmaking with Olam: Here are its other acquisitions,https://economictimes.indiatimes.com/tech/information-tech/wipro-steps-up-dealmaking-with-olam-here-are-its-other-acquisitions/articleshow/130066398.cms,2026-04-07 01:43:47
economictimes,,Amazon India to shut down Fresh in top cities amid quick commerce push: UBS report,https://economictimes.indiatimes.com/tech/technology/amazon-india-to-shut-down-fresh-in-top-cities-amid-quick-commerce-push-ubs-report/articleshow/130066075.cms,2026-04-07 01:43:47
economictimes,,Delhi HC orders restoration of blocked X accounts,https://economictimes.indiatimes.com/tech/technology/delhi-hc-orders-restoration-of-blocked-x-accounts/articleshow/130065931.cms,2026-04-07 00:46:38
economictimes,,Bluesky down for thousands of users in the US,https://economictimes.indiatimes.com/tech/technology/bluesky-down-for-thousands-of-users-in-the-us/articleshow/130065809.cms,2026-04-07 00:46:38
economictimes,,"Samsung is discontinuing its texting app, tells impacted users to switch to Google Messages",https://economictimes.indiatimes.com/tech/technology/samsung-is-discontinuing-its-texting-app-tells-impacted-users-to-switch-to-google-messages/articleshow/130064745.cms,2026-04-06 23:45:51
economictimes,,Everstone leads $150 million infusion in SaaS firm Wingify,https://economictimes.indiatimes.com/tech/startups/everstone-leads-150-million-infusion-in-saas-firm-wingify/articleshow/130063558.cms,2026-04-06 22:30:55
economictimes,,Nykaa eyes Deepika Padukone's 82°E; Wipro seals $1B deal,https://economictimes.indiatimes.com/tech/newsletters/tech-top-5/nykaa-eyes-deepika-padukones-82e-wipro-seals-1b-deal/articleshow/130062370.cms,2026-04-06 22:30:55
economictimes,,WeWork India to set up 5 co-working centres in South India,https://economictimes.indiatimes.com/tech/technology/wework-india-to-set-up-5-co-working-centres-in-south-india/articleshow/130062303.cms,2026-04-06 22:30:55
economictimes,,GeM facilitates transactions worth Rs 5.03 lakh crore in 2025-26,https://economictimes.indiatimes.com/tech/technology/gem-facilitates-transactions-worth-rs-5-03-lakh-crore-in-2025-26/articleshow/130061986.cms,2026-04-06 22:30:55
economictimes,,"Investors press Amazon, Microsoft and Google on water, power use in US data centres",https://economictimes.indiatimes.com/tech/artificial-intelligence/investors-press-amazon-microsoft-and-google-on-water-power-use-in-us-data-centres/articleshow/130061844.cms,2026-04-06 22:30:55
economictimes,,JIIF plans to invest Rs 80-100 crore in 12-18 months in early-stage startups,https://economictimes.indiatimes.com/tech/funding/jiif-plans-to-invest-rs-80-100-cr-in-12-18-months-in-early-stage-startups/articleshow/130061846.cms,2026-04-06 22:30:55
economictimes,,Oracle appoints Hilary Maxson as CFO,https://economictimes.indiatimes.com/tech/technology/oracle-appoints-hilary-maxson-as-cfo/articleshow/130060905.cms,2026-04-06 21:09:44
economictimes,,Meet the new AI coworker who won’t stop snitching to your boss,https://economictimes.indiatimes.com/tech/artificial-intelligence/meet-the-new-ai-coworker-who-wont-stop-snitching-to-your-boss/articleshow/130060628.cms,2026-04-06 21:09:44
economictimes,,Spacetech startup SatLeo Labs raises $2.2 million from Unicorn Ventures,https://economictimes.indiatimes.com/tech/startups/spacetech-startup-satleo-labs-raises-2-2-million-from-unicorn-ventures/articleshow/130060486.cms,2026-04-06 21:09:44
economictimes,,US regulator ends probe into Tesla's 'actually smart summon' feature after software fixes,https://economictimes.indiatimes.com/tech/technology/us-regulator-ends-probe-into-teslas-actually-smart-summon-feature-after-software-fixes/articleshow/130059093.cms,2026-04-06 19:49:41
economictimes,,Magicpin launches AI assistant ‘Vera’; commits $1 million to build AI stack,https://economictimes.indiatimes.com/tech/artificial-intelligence/magicpin-launches-ai-assistant-vera-commits-1-million-to-build-ai-stack/articleshow/130055645.cms,2026-04-06 17:09:02
economictimes,,Meta layoffs: around 200 employees to be terminated amid AI push,https://economictimes.indiatimes.com/tech/technology/meta-layoffs-around-200-employees-to-be-terminated-amid-ai-push/articleshow/130055515.cms,2026-04-06 17:09:02
economictimes,,Bold promises vs. hard proof: Indian IT faces an AI test this fiscal,https://economictimes.indiatimes.com/prime/technology-and-startups/bold-promises-vs-hard-proof-indian-it-faces-an-ai-test-this-fiscal/primearticleshow/130038818.cms,2026-04-06 08:12:39
economictimes,,Unconventional ways during war and uncertain times: 4 stocks with dividend yield of up to 5.9%,https://economictimes.indiatimes.com/markets/stocks/news/unconventional-ways-during-war-and-uncertain-times-4-stocks-with-dividend-yield-of-up-to-5-9/articleshow/130034602.cms,2026-04-06 08:12:39
economictimes,,Most difficult: Staying invested in businesses while ignoring noise called Gulf war; 19 stocks from different sectors to ‘hold’,https://economictimes.indiatimes.com/markets/stocks/news/most-difficult-staying-invested-in-businesses-while-ignoring-noise-called-gulf-war-19-stocks-from-different-sectors-to-hold/articleshow/130032003.cms,2026-04-06 08:12:39
economictimes,,"Italian court rules Netflix price-hike clauses are void, orders refunds",https://economictimes.indiatimes.com/tech/technology/italian-court-rules-netflix-price-hike-clauses-are-void-orders-refunds/articleshow/130043785.cms,2026-04-06 08:12:39
economictimes,,Trump administration proposes expanding Chinese tech gear crackdown,https://economictimes.indiatimes.com/tech/technology/trump-administration-proposes-expanding-chinese-tech-gear-crackdown/articleshow/130043666.cms,2026-04-06 08:12:39
economictimes,,Kremlin's drive for a state-backed messaging app touches a nerve for some,https://economictimes.indiatimes.com/tech/technology/kremlins-drive-for-a-state-backed-messaging-app-touches-a-nerve-for-some/articleshow/130043561.cms,2026-04-06 08:12:39
economictimes,,Nykaa sees fourth quarter consolidated GMV growth in high-20% range,https://economictimes.indiatimes.com/tech/technology/nykaa-sees-fourth-quarter-consolidated-gmv-growth-in-high-20-range/articleshow/130050815.cms,2026-04-06 06:36:19
economictimes,,OpenAI CFO concerned over Sam Altman's 2026 IPO plans: The Information,https://economictimes.indiatimes.com/tech/artificial-intelligence/openai-cfo-raises-concerns-over-sam-altmans-2026-ipo-plans-the-information/articleshow/130050173.cms,2026-04-06 06:36:19
economictimes,,China issues guidance for ecommerce including for cross-border trade,https://economictimes.indiatimes.com/tech/technology/china-issues-guidance-for-ecommerce-including-for-cross-border-trade/articleshow/130049361.cms,2026-04-06 06:36:19
economictimes,,Wipro bags $1 billion deal from Olam Group; to acquire Mindsprint for $375 million,https://economictimes.indiatimes.com/tech/information-tech/singapores-olam-to-sell-it-unit-to-wipro-for-375-million/articleshow/130048892.cms,2026-04-06 06:36:19
economictimes,,Gig worker shortage continues; IT weathers war jitters,https://economictimes.indiatimes.com/tech/newsletters/morning-dispatch/platforms-brace-for-gig-worker-crunch-indian-it-steady-amid-war-clouds/articleshow/130048730.cms,2026-04-06 06:36:19
economictimes,,Semicon Mission 2.0 set to prioritise memory chips,https://economictimes.indiatimes.com/tech/technology/semicon-mission-2-0-set-to-prioritise-memory-chips/articleshow/130045533.cms,2026-04-06 06:36:19
economictimes,,"ETtech Explainer: Agentic harness, the software that makes AI tick",https://economictimes.indiatimes.com/tech/artificial-intelligence/ettech-explainer-agentic-harness-the-software-that-makes-ai-tick/articleshow/130044887.cms,2026-04-06 06:36:19
economictimes,,Indian IT companies likely to dodge West Asia war volleys in Q4,https://economictimes.indiatimes.com/tech/information-tech/indian-it-companies-likely-to-dodge-west-asia-war-volleys-in-q4/articleshow/130044613.cms,2026-04-06 06:36:19
economictimes,,Platforms brace for impact as gig workforce returns home,https://economictimes.indiatimes.com/tech/startups/platforms-brace-for-impact-as-gig-workforce-returns-home/articleshow/130044277.cms,2026-04-06 06:36:19
economictimes,,Nykaa in talks to buy majority stake in Deepika Padukone's skincare brand 82°E,https://economictimes.indiatimes.com/tech/technology/nykaa-in-talks-to-buy-majority-stake-in-deepika-padukones-skincare-brand-82e/articleshow/130049820.cms,2026-04-06 06:36:19
economictimes,,$15 billion investment: Google to kick off data centre project on April 28,https://economictimes.indiatimes.com/tech/technology/15-billion-investment-google-to-kick-off-data-centre-project-on-april-28/articleshow/130050016.cms,2026-04-06 06:36:19
economictimes,,"AI is reshaping lending, and why it’s bad news for traditional banks",https://economictimes.indiatimes.com/prime/fintech-and-bfsi/ai-is-reshaping-lending-and-why-its-bad-news-for-traditional-banks/primearticleshow/129514653.cms,2026-04-05 18:46:39
economictimes,,"Looking for a job? This city has plenty, few takers",https://economictimes.indiatimes.com/prime/corporate-governance/looking-for-a-job-this-city-has-plenty-few-takers/primearticleshow/129329091.cms,2026-04-05 18:46:39
economictimes,,"HDFC Bank seeks to rebuild trust, the biggest currency in banking",https://economictimes.indiatimes.com/prime/fintech-and-bfsi/hdfc-bank-seeks-to-rebuild-trust-the-biggest-currency-in-banking/primearticleshow/129674165.cms,2026-04-05 18:46:39
economictimes,,SaaS faces an AI shake-up. An opportunity for Indian IT?,https://economictimes.indiatimes.com/prime/technology-and-startups/saas-faces-an-ai-shake-up-an-opportunity-for-indian-it/primearticleshow/129450951.cms,2026-04-05 18:46:39
economictimes,,Is govt’s fuel tax balancing act enough to avoid crude shock?,https://economictimes.indiatimes.com/prime/energy/is-govts-fuel-tax-balancing-act-enough-to-avoid-crude-shock/primearticleshow/129880351.cms,2026-04-05 18:46:39
economictimes,,"5 stocks with consistent score improvement and upside potential of up to 26% in 1 year, according to analysts",https://economictimes.indiatimes.com/markets/stocks/news/5-stocks-with-consistent-score-improvement-and-upside-potential-of-up-to-26-in-1-year-according-to-analysts/articleshow/130011322.cms,2026-04-05 18:46:39
economictimes,,Defending the rupee: Understanding the RBI’s new rules. Will they work?,https://economictimes.indiatimes.com/markets/stocks/news/defending-the-rupee-understanding-the-rbis-new-rules-will-they-work/articleshow/129998328.cms,2026-04-05 18:46:39
economictimes,,"These large- and mid-cap stocks can give more than 25% return in 1 year, according to analysts",https://economictimes.indiatimes.com/markets/stocks/news/these-large-and-mid-cap-stocks-can-give-more-than-25-return-in-1-year-according-to-analysts/articleshow/129987110.cms,2026-04-05 18:46:39
economictimes,,Accenture is pressing the AI pedal. What’s stopping Indian IT then?,https://economictimes.indiatimes.com/prime/technology-and-startups/accenture-is-pressing-the-ai-pedal-whats-stopping-indian-it-then/primearticleshow/129772941.cms,2026-04-05 18:46:39
economictimes,,"What affects the rupee more — crude oil prices, or FPI sale?",https://economictimes.indiatimes.com/prime/money-and-markets/what-affects-the-rupee-more-crude-oil-prices-or-fpi-sale/primearticleshow/129750833.cms,2026-04-05 18:46:39
economictimes,,HDFC Bank chair exit: Widening rift or a new beginning?,https://economictimes.indiatimes.com/prime/corporate-governance/hdfc-bank-chair-exit-widening-rift-or-a-new-beginning/primearticleshow/129673624.cms,2026-04-05 18:46:39
economictimes,,From conflict to cockpits: Iranian pilots turn to India as airlines race to hire,https://economictimes.indiatimes.com/prime/transportation/from-conflict-to-cockpits-iranian-pilots-turn-to-india-as-airlines-race-to-hire/primearticleshow/129820535.cms,2026-04-05 18:46:39
economictimes,,"After Go First horror, can à la Dublin at GIFT City comfort aircraft lessors?",https://economictimes.indiatimes.com/prime/transportation/after-go-first-horror-can-la-dublin-at-gift-city-comfort-aircraft-lessors/primearticleshow/129729391.cms,2026-04-05 18:46:39
economictimes,,"Artemis 2 and the new space race: Colonisation, commerce, or survival?",https://economictimes.indiatimes.com/opinion/et-editorial/artemis-2-and-the-new-space-race-colonisation-commerce-or-survival/articleshow/129986772.cms,2026-04-05 18:46:39
economictimes,,How a cozy club controls India’s gold imports,https://economictimes.indiatimes.com/prime/corporate-governance/how-a-cozy-club-controls-indias-gold-imports/primearticleshow/129950489.cms,2026-04-05 18:46:39
economictimes,,Trade was just the first casualty; RBI rate cuts may be next in the Iran War fallout,https://economictimes.indiatimes.com/prime/economy-and-policy/trade-was-just-the-first-casualty-rbi-rate-cuts-may-be-next-in-the-iran-war-fallout/primearticleshow/129923824.cms,2026-04-05 18:46:39
economictimes,,AI puts India’s USD190-billion services trade surplus at a crossroads,https://economictimes.indiatimes.com/prime/economy-and-policy/ai-puts-indias-usd190-billion-services-trade-surplus-at-a-crossroads/primearticleshow/129085894.cms,2026-04-05 18:46:39
economictimes,,"As IPO nears, NSE looks to settle long-running predatory pricing case",https://economictimes.indiatimes.com/prime/corporate-governance/as-ipo-nears-nse-looks-to-settle-long-running-predatory-pricing-case/primearticleshow/128711766.cms,2026-04-05 18:46:39
economictimes,,Beyond biscuits: ‘Forgotten brands’ power Britannia’s rise amid FMCG fall,https://economictimes.indiatimes.com/prime/consumer/beyond-biscuits-forgotten-brands-power-britannias-rise-amid-fmcg-fall/primearticleshow/128549479.cms,2026-04-05 18:46:39
economictimes,,"Buy, Sell or Hold: Morgan Stanley maintains overweight rating on BEL &amp;amp; Jubilant FoodWorks",https://economictimes.indiatimes.com/markets/stocks/news/buy-sell-or-hold-morgan-stanley-maintains-overweight-rating-on-bel-jubilant-foodworks/articleshow/129941060.cms,2026-04-05 18:46:39
economictimes,,"Think beyond the war? 8 stocks from different segments of the engineering and capital goods sector, with upside potential of 6 to 42%",https://economictimes.indiatimes.com/markets/stocks/news/think-beyond-the-war-8-stocks-from-different-segments-of-the-engineering-and-capital-goods-sector-with-upside-potential-of-6-to-42/articleshow/129946544.cms,2026-04-05 18:46:39
economictimes,,"Where aircraft go when they need a safe haven – or to die. As the Gulf war draws attention to ‘boneyards’, where does India stand?",https://economictimes.indiatimes.com/markets/stocks/news/where-aircraft-go-when-they-need-a-safe-haven-or-to-die-as-the-gulf-war-draws-attention-to-boneyards-where-does-india-stand/articleshow/129957425.cms,2026-04-05 18:46:39
economictimes,,Jyoti Structures bankruptcy shows how revival can drag for nearly a decade,https://economictimes.indiatimes.com/prime/corporate-governance/insolvency-to-new-start-nclat-order-rekindles-hopes-for-jyoti-structures/primearticleshow/128745454.cms,2026-04-05 18:46:39
economictimes,,Prashant Jain’s contrarian masterstroke: From IT exit to SBI super bet,https://economictimes.indiatimes.com/prime/money-and-markets/prashant-jains-contrarian-masterstroke-from-it-exit-to-sbi-super-bet/primearticleshow/128962095.cms,2026-04-05 18:46:39
economictimes,,Stock Radar: GE Vernova T&amp;amp;D India stock sees profit booking after hitting record highs in March 2026; buy the dip or book profits?,https://economictimes.indiatimes.com/markets/stocks/news/stock-radar-ge-td-india-stock-sees-profit-booking-after-hitting-record-highs-in-march-2026-buy-the-dip-or-book-profits/articleshow/129901022.cms,2026-04-05 18:46:39
economictimes,,Weekly Top Picks: These stocks scored 10 on 10 on Stock Reports Plus,https://economictimes.indiatimes.com/markets/stocks/news/weekly-top-picks-these-stocks-scored-10-on-10-on-stock-reports-plus/articleshow/129901767.cms,2026-04-05 18:46:39
economictimes,,These large-caps have ‘strong buy’ &amp;amp; ‘buy’ recos and an upside potential of more than 25%,https://economictimes.indiatimes.com/markets/stocks/news/these-large-caps-have-strong-buy-buy-recos-and-an-upside-potential-of-more-than-25/articleshow/129908575.cms,2026-04-05 18:46:39
economictimes,,Tourism and hospitality ecosystem: Will it get hit harder due to the war’s second-order effect? 20 stocks to keep an eye on,https://economictimes.indiatimes.com/markets/stocks/news/tourism-and-hospitality-ecosystem-will-it-get-hit-harder-due-to-the-wars-second-order-effect-20-stocks-to-keep-an-eye-on/articleshow/129928094.cms,2026-04-05 18:46:39
economictimes,,"Crashes, chaos: A nightmarish fiscal Air India, IndiGo and govt may like to forget",https://economictimes.indiatimes.com/prime/transportation/crashes-chaos-a-nightmarish-fiscal-air-india-indigo-may-like-to-forget/primearticleshow/129901778.cms,2026-04-05 18:46:39
economictimes,,"How IndiGo-Air India duopoly is causing turbulence at MakeMyTrip, peers",https://economictimes.indiatimes.com/prime/transportation/how-indigo-air-india-duopoly-is-causing-turbulence-at-makemytrip-peers/primearticleshow/128500843.cms,2026-04-05 18:46:39
economictimes,,Why gold volume is plunging in GIFT City when prices soar,https://economictimes.indiatimes.com/prime/economy-and-policy/when-gold-soars-gift-volumes-plunge-over-flip-flops-on-import-quota/primearticleshow/129590033.cms,2026-04-05 18:46:39
economictimes,,"Buy, Sell or Hold: Goldman Sachs recommends buy on LG Electronics; Motilal Oswal upgrades Eicher Motors",https://economictimes.indiatimes.com/markets/stocks/news/buy-sell-or-hold-goldman-sachs-recommends-buy-on-lg-electronics-motilal-oswal-upgrades-eicher-motors/articleshow/129890855.cms,2026-04-05 18:46:39
economictimes,,"5 stocks from different sectors with score improvement and upside potential of up to 33% in one year, according to analysts",https://economictimes.indiatimes.com/markets/stocks/news/5-stocks-from-different-sectors-with-score-improvement-and-upside-potential-of-up-to-33-in-one-year-according-to-analysts/articleshow/129895502.cms,2026-04-05 18:46:39
economictimes,,AI-led demand to drive sharp surge in semiconductor revenues: Goldman Sachs,https://economictimes.indiatimes.com/tech/artificial-intelligence/ai-led-demand-to-drive-sharp-surge-in-semiconductor-revenues-goldman-sachs/articleshow/130036959.cms,2026-04-05 18:46:39
economictimes,,Why should you create personal knowledge bases for quicker responses to queries? Andrej Karpathy explains,https://economictimes.indiatimes.com/tech/artificial-intelligence/why-should-you-create-personal-knowledge-bases-for-quicker-responses-to-queries-andrej-karpathy-explains/articleshow/130036489.cms,2026-04-05 18:46:39
economictimes,,"Startups that solved AI mapping problem generated 1.9x higher revenue, study finds",https://economictimes.indiatimes.com/tech/startups/startups-that-solved-ai-mapping-problem-generated-1-9x-higher-revenue-study-finds/articleshow/130036394.cms,2026-04-05 18:46:39
economictimes,,Foxconn first-quarter revenue jumps 30% year-on-year ​fuelled by ⁠strong ‌AI-related demand,https://economictimes.indiatimes.com/tech/technology/foxconn-first-quarter-revenue-jumps-30-year-on-year-fuelled-by-strong-ai-related-demand/articleshow/130035403.cms,2026-04-05 18:46:39
economictimes,,"Indian film studios are using AI to cut costs, speed production, despite mixed audience reactions",https://economictimes.indiatimes.com/tech/artificial-intelligence/indian-studios-use-ai-to-cut-costs-speed-production-despite-mixed-audience-reactions/articleshow/130034364.cms,2026-04-05 18:46:39
economictimes,,"Samsung, Mistral AI discuss cooperation in AI memory sector",https://economictimes.indiatimes.com/tech/artificial-intelligence/samsung-mistral-ai-discuss-cooperation-in-ai-memory-sector/articleshow/130034001.cms,2026-04-05 18:46:39
economictimes,,What is Project Maven? Pentagon’s flagship AI program powering US strikes on Iran,https://economictimes.indiatimes.com/tech/artificial-intelligence/what-is-project-maven-pentagons-flagship-ai-program-powering-us-strikes-on-iran/articleshow/130033752.cms,2026-04-05 18:46:39
economictimes,,Britain woos expansion effort by Anthropic after US defence clash: Report,https://economictimes.indiatimes.com/tech/artificial-intelligence/britain-woos-expansion-effort-by-anthropic-after-us-defence-clash-report/articleshow/130033754.cms,2026-04-05 18:46:39
economictimes,,Zaggle CFO Aditya Kumar steps down; Rajesh Tummalaganti named interim finance chief,https://economictimes.indiatimes.com/tech/technology/zaggle-cfo-aditya-kumar-steps-down-rajesh-tummalaganti-named-interim-finance-chief/articleshow/130024729.cms,2026-04-05 18:46:39
economictimes,,Telegram's Durov says Russia triggered payment system problem by blocking VPNs,https://economictimes.indiatimes.com/tech/technology/telegrams-durov-says-russia-triggered-payment-system-problem-by-blocking-vpns/articleshow/130022990.cms,2026-04-05 18:46:39
economictimes,,Strategic blunder or genius?: Y Combinator’s Garry Tan reacts on Anthropic’s OpenClaw move,https://economictimes.indiatimes.com/tech/technology/strategic-blunder-or-genius-y-combinators-garry-tan-reacts-on-anthropics-openclaw-move/articleshow/130022846.cms,2026-04-05 18:46:39
economictimes,,Strategic blunder or genius?: Y Combinator’s Garry Tan reacts on Anthropic’s OpenClaw move,https://economictimes.indiatimes.com/tech/artificial-intelligence/strategic-blunder-or-genius-y-combinators-garry-tan-reacts-on-anthropics-openclaw-move/articleshow/130022823.cms,2026-04-05 18:46:39
economictimes,,"Gujarat HC bars AI use in decision-making, judgment drafting",https://economictimes.indiatimes.com/tech/artificial-intelligence/gujarat-hc-bars-ai-use-in-decision-making-judgment-drafting/articleshow/130022289.cms,2026-04-05 18:46:39
economictimes,,"US tightens chip export controls, curb China's tech rise",https://economictimes.indiatimes.com/tech/technology/us-tightens-chip-export-controls-curb-chinas-tech-rise/articleshow/130020543.cms,2026-04-05 18:46:39
economictimes,,LAT Aerospace prototype aircraft crashes during ground roll test,https://economictimes.indiatimes.com/tech/startups/lat-aerospaces-prototype-aircraft-crashes-during-ground-test-near-saifai/articleshow/130020081.cms,2026-04-05 18:46:39
economictimes,,"SemiAnalysis sues former employee over misconduct, trade secret claims",https://economictimes.indiatimes.com/tech/technology/semianalysis-sues-former-employee-over-misconduct-trade-secret-claims/articleshow/130019522.cms,2026-04-05 18:46:39
economictimes,,Delve row explained: What led to its split from Y Combinator,https://economictimes.indiatimes.com/tech/startups/delve-row-explained-what-led-to-its-split-from-y-combinator/articleshow/130019248.cms,2026-04-05 18:46:39
