domain,company,title,url,crawled_at
nikkei,,"Japan bullet train's private rooms boast latest soundproofing, Wi-Fi tech",https://asia.nikkei.com/business/transportation/japan-bullet-train-s-private-rooms-boast-latest-soundproofing-wi-fi-tech,2026-04-15 06:44:44
nikkei,,China snaps up US chip tools via Southeast Asia amid supply chain shift,https://asia.nikkei.com/business/technology/tech-asia/china-snaps-up-us-chip-tools-via-southeast-asia-amid-supply-chain-shift,2026-04-15 05:52:25
nikkei,,China's more-than-decade-late sanctions ineffective as leverage on Japan,https://asia.nikkei.com/opinion/china-s-more-than-decade-late-sanctions-ineffective-as-leverage-on-japan,2026-04-15 04:53:44
nikkei,,Japan's prefectures and local banks help small firms weather Iran storm,https://asia.nikkei.com/economy/japan-s-prefectures-and-local-banks-help-small-firms-weather-iran-storm,2026-04-15 04:53:44
nikkei,,Japan to ban in-flight use of portable power banks from this month,https://asia.nikkei.com/business/travel-leisure/japan-to-ban-in-flight-use-of-portable-power-banks-from-this-month,2026-04-15 03:48:50
nikkei,,"Amazon Autos adds Mazdas, Subarus to offerings in US",https://asia.nikkei.com/business/automobiles/amazon-autos-adds-mazdas-subarus-to-offerings-in-us,2026-04-15 03:48:50
nikkei,,"Private credit funds attract Japan investors, more than doubling in 1 year",https://asia.nikkei.com/business/finance/private-credit-funds-attract-japan-investors-more-than-doubling-in-1-year,2026-04-15 03:48:50
nikkei,,"Nasdaq-listed PayPay to roll out services at 400,000 stores in Taiwan",https://asia.nikkei.com/business/finance/nasdaq-listed-paypay-to-roll-out-services-at-400-000-stores-in-taiwan,2026-04-15 02:04:36
nikkei,,"China's Oppo takes on iPhone in Japan with $2,000 foldable phone",https://asia.nikkei.com/business/technology/china-s-oppo-takes-on-iphone-in-japan-with-2-000-foldable-phone,2026-04-15 02:04:36
nikkei,,China's Hainan resort island welcomes wave of Russian tourism,https://asia.nikkei.com/business/travel-leisure/china-s-hainan-resort-island-welcomes-wave-of-russian-tourism,2026-04-15 02:04:36
nikkei,,Invesco to enter Japan ETF market amid deregulation push,https://asia.nikkei.com/business/markets/equities/invesco-to-enter-japan-etf-market-amid-deregulation-push,2026-04-15 02:04:36
nikkei,,"Soaring oil prices threaten Japan's municipal bus, sewer services",https://asia.nikkei.com/spotlight/iran-tensions/iran-war/soaring-oil-prices-threaten-japan-s-municipal-bus-sewer-services,2026-04-15 02:04:36
nikkei,,Japan's Asahi Kasei to delay Canada plant opening on Honda EV slump,https://asia.nikkei.com/business/materials/japan-s-asahi-kasei-to-delay-canada-plant-opening-on-honda-ev-slump,2026-04-15 00:40:36
nikkei,,"Tesla's Shanghai factory can build humanoid robots, China boss says",https://asia.nikkei.com/business/technology/tesla-s-shanghai-factory-can-build-humanoid-robots-china-boss-says,2026-04-15 00:40:36
nikkei,,"IMF cuts growth forecasts for Asia's emerging economies, blames Iran war",https://asia.nikkei.com/economy/imf-cuts-growth-forecasts-for-asia-s-emerging-economies-blames-iran-war,2026-04-14 21:50:26
nikkei,,"TikTok, Sea, Alibaba-owned e-commerce corner ASEAN markets",https://asia.nikkei.com/business/retail/tiktok-sea-alibaba-owned-e-commerce-corner-asean-markets,2026-04-14 21:50:26
nikkei,,"China set to fine PDD, other e-tailers over food delivery concerns: sources",https://asia.nikkei.com/business/companies/china-set-to-fine-pdd-other-e-tailers-over-food-delivery-concerns-sources,2026-04-14 19:57:40
nikkei,,"Japan's Mitsubishi Estate, Shimizu to build Singapore food logistics plant",https://asia.nikkei.com/business/food-beverage/japan-s-mitsubishi-estate-shimizu-to-build-singapore-food-logistics-plant2,2026-04-14 19:57:40
nikkei,,Asian stocks begin to recoup losses from impact of Iran war,https://asia.nikkei.com/business/markets/asian-stocks-begin-to-recoup-losses-from-impact-of-iran-war,2026-04-14 18:45:30
nikkei,,"Philippine, US military drills to facilitate closer relations with Japan",https://asia.nikkei.com/politics/international-relations/south-china-sea/philippine-us-military-drills-to-facilitate-closer-relations-with-japan2,2026-04-14 18:45:30
nikkei,,"Global oil demand to fall this year led by Asia, IEA says",https://asia.nikkei.com/spotlight/iran-tensions/iran-war/global-oil-demand-to-fall-this-year-led-by-asia-iea-says,2026-04-14 18:45:30
nikkei,,Pakistani jets deployed to Saudi Arabia highlight its Iran war dilemma,https://asia.nikkei.com/spotlight/iran-tensions/iran-war/pakistani-jets-deployed-to-saudi-arabia-highlight-its-iran-war-dilemma,2026-04-14 17:02:09
nikkei,,US-sanctioned Chinese tanker transits Strait of Hormuz hours after blockade,https://asia.nikkei.com/spotlight/iran-tensions/iran-war/us-sanctioned-chinese-tanker-transits-strait-of-hormuz-hours-after-blockade,2026-04-14 17:02:09
nikkei,,Ukraine's drone tech can help bolster Japan's national security,https://asia.nikkei.com/opinion/ukraine-s-drone-tech-can-help-bolster-japan-s-national-security,2026-04-14 17:02:09
nikkei,,China and Vietnam's communist chiefs meet: 5 things to know,https://asia.nikkei.com/politics/international-relations/china-and-vietnam-s-communist-chiefs-meet-5-things-to-know,2026-04-14 17:02:09
nikkei,,"Indian auto, textile production hit as gas crunch drives workers home",https://asia.nikkei.com/spotlight/iran-tensions/iran-war/indian-auto-textile-production-hit-as-gas-crunch-drives-workers-home,2026-04-14 15:07:43
nikkei,,Asian stocks recoup losses from impacts of Iran war,https://asia.nikkei.com/business/markets/asian-stocks-recoup-losses-from-impacts-of-iran-war,2026-04-14 15:07:43
nikkei,,Qantas flags fuel cost impact as oil crisis forces cuts to flights,https://asia.nikkei.com/spotlight/iran-tensions/iran-war/qantas-flags-fuel-cost-impact-as-oil-crisis-forces-cuts-to-flights,2026-04-14 15:07:43
nikkei,,Taiwan chip industry looks to avoid energy and helium shortages,https://asia.nikkei.com/spotlight/podcasts/podcast-tech-latest/taiwan-chip-industry-looks-to-avoid-energy-and-helium-shortages,2026-04-14 13:23:39
nikkei,,Sri Lanka's economic turnaround braces for testing times amid Iran conflict,https://asia.nikkei.com/economy/sri-lanka-s-economic-turnaround-braces-for-testing-times-amid-iran-conflict,2026-04-14 13:23:39
nikkei,,Nissan cuts model lineup by 20% as it unveils new AI tech strategy,https://asia.nikkei.com/business/automobiles/nissan-cuts-model-lineup-by-20-as-it-unveils-new-ai-tech-strategy,2026-04-14 13:23:39
nikkei,,China's export growth slows as Iran war pushes up import bill,https://asia.nikkei.com/economy/trade/china-s-export-growth-slows-as-iran-war-pushes-up-import-bill,2026-04-14 13:23:39
nikkei,,South Korea and Japan on edge as US shifts military assets to Iran war,https://asia.nikkei.com/politics/defense/south-korea-and-japan-on-edge-as-us-shifts-military-assets-to-iran-war,2026-04-14 13:23:39
nikkei,,"Japan, South Korea stocks near highs reached before Iran war",https://asia.nikkei.com/business/markets/japan-south-korea-stocks-near-highs-reached-before-iran-war,2026-04-14 13:23:39
nikkei,,"Singapore Q1 preliminary GDP up 4.6% on year, misses 5.9% forecast",https://asia.nikkei.com/economy/singapore-q1-preliminary-gdp-up-4.6-on-year-misses-5.9-forecast,2026-04-14 10:31:16
nikkei,,Foreign investors bet on revamp of Bangladesh's informal retail sector,https://asia.nikkei.com/business/retail/foreign-investors-bet-on-revamp-of-bangladesh-s-informal-retail-sector,2026-04-14 10:31:16
nikkei,,PLS chief sees 'supply shortness' and higher prices ahead for lithium,https://asia.nikkei.com/business/markets/commodities/pls-chief-sees-supply-shortness-and-higher-prices-ahead-for-lithium,2026-04-14 10:31:16
nikkei,,"New Hungary PM seen resetting rules for China, EV sector: 4 things to know",https://asia.nikkei.com/politics/international-relations/new-hungary-pm-seen-resetting-rules-for-china-ev-sector-4-things-to-know,2026-04-14 10:31:16
nikkei,,Vingroup launches first bullet train project linking Vietnamese cities,https://asia.nikkei.com/business/transportation/vingroup-launches-first-bullet-train-project-linking-vietnamese-cities,2026-04-14 10:31:16
nikkei,,Cambodia eyes 7-fold expansion of deep-water port with help from Japan,https://asia.nikkei.com/business/transportation/cambodia-eyes-7-fold-expansion-of-deep-water-port-with-help-from-japan,2026-04-14 06:31:28
nikkei,,"Shiseido, Lululemon weather China economic slump with luxury strategy",https://asia.nikkei.com/business/consumer/shiseido-lululemon-weather-china-economic-slump-with-luxury-strategy,2026-04-14 06:31:28
nikkei,,Japan's MinebeaMitsumi eyes Cambodia as 'strategic base' for exports to US,https://asia.nikkei.com/business/electronics/japan-s-minebeamitsumi-eyes-cambodia-as-strategic-base-for-exports-to-us,2026-04-14 05:51:14
nikkei,,"SoftBank taps Honda, other manufacturers for input on physical AI",https://asia.nikkei.com/business/softbank/softbank-taps-honda-other-manufacturers-for-input-on-physical-ai,2026-04-14 05:51:14
nikkei,,Singapore banks chase wealth inflows as Iran war lifts safe-haven appeal,https://asia.nikkei.com/spotlight/asean-money/singapore-banks-chase-wealth-inflows-as-iran-war-lifts-safe-haven-appeal,2026-04-14 05:51:14
nikkei,,"Fujitsu aims to become AI alternative to US, China players",https://asia.nikkei.com/business/technology/artificial-intelligence/fujitsu-aims-to-become-ai-alternative-to-us-china-players,2026-04-14 05:51:14
nikkei,,"Shanghai names Toyota, JETRO in push to attract foreign businesses",https://asia.nikkei.com/politics/international-relations/japan-china-tensions/shanghai-names-toyota-jetro-in-push-to-attract-foreign-businesses2,2026-04-14 04:56:09
nikkei,,Japan's Takaichi targets spring 2027 for advancing constitutional revisions,https://asia.nikkei.com/politics/japan-s-takaichi-targets-spring-2027-for-advancing-constitutional-revisions,2026-04-14 03:47:30
nikkei,,Japan label maker OSP Holdings buys US peer Merchant,https://asia.nikkei.com/business/business-deals/japan-label-maker-osp-holdings-buys-us-peer-merchant,2026-04-14 03:47:30
nikkei,,"Japan shipbuilding orders fall 15%, despite push from Tokyo",https://asia.nikkei.com/business/transportation/japan-shipbuilding-orders-fall-15-despite-push-from-tokyo,2026-04-14 02:01:15
nikkei,,Tokyo-London airfares climb 90% on Iran war turmoil,https://asia.nikkei.com/business/transportation/tokyo-london-airfares-climb-90-on-iran-war-turmoil,2026-04-14 02:01:15
nikkei,,Japan's Infroneer to buy waterworks operator Swing for $560m,https://asia.nikkei.com/business/business-deals/japan-s-infroneer-to-buy-waterworks-operator-swing-for-560m,2026-04-14 02:01:15
nikkei,,"Barclays keeping eye on volatile private credit market, CEO says",https://asia.nikkei.com/editor-s-picks/interview/barclays-keeping-eye-on-volatile-private-credit-market-ceo-says,2026-04-14 00:42:42
nikkei,,"Indonesia's Prabowo meets Putin in Moscow, pushed closer by US-Iran war",https://asia.nikkei.com/politics/international-relations/indonesia-s-prabowo-meets-putin-in-moscow-pushed-closer-by-us-iran-war,2026-04-14 00:42:42
nikkei,,Japan eateries gird for labor crunch as foreign-worker quota fills up,https://asia.nikkei.com/spotlight/japan-immigration/japan-eateries-gird-for-labor-crunch-as-foreign-worker-quota-fills-up,2026-04-14 00:42:42
nikkei,,SBI and US firm Across Ventures to launch $100m fund backing 'micro-VCs',https://asia.nikkei.com/business/finance/sbi-and-us-firm-across-ventures-to-launch-100m-fund-backing-micro-vcs,2026-04-13 23:01:49
nikkei,,China calls for calm as Trump's planned Iran blockade raises pressure,https://asia.nikkei.com/spotlight/iran-tensions/iran-war/china-calls-for-calm-as-trump-s-planned-iran-blockade-raises-pressure,2026-04-13 18:13:33
nikkei,,Japan's Toto suspends pre-fab bath orders as Iran war hits glue supply,https://asia.nikkei.com/spotlight/supply-chain/japan-s-toto-suspends-pre-fab-bath-orders-as-iran-war-hits-glue-supply,2026-04-13 16:03:02
nikkei,,Vingroup launches first bullet train linking Vietnamese cities,https://asia.nikkei.com/business/transportation/vingroup-launches-first-bullet-train-linking-vietnamese-cities,2026-04-13 16:03:02
nikkei,,"Japan's matcha, wagyu, tuna exports to Middle East hit by Iran War",https://asia.nikkei.com/spotlight/iran-tensions/iran-war/japan-s-matcha-wagyu-tuna-exports-to-middle-east-hit-by-iran-war,2026-04-13 16:03:02
nikkei,,"India, Russia could benefit with oil, gas deals amid Iran conflict",https://asia.nikkei.com/business/energy/india-russia-could-benefit-with-oil-gas-deals-amid-iran-conflict,2026-04-13 13:41:45
nikkei,,Japan bond yields hit 29-year high as Iran impasse stokes inflation fears,https://asia.nikkei.com/business/markets/bonds/japan-bond-yields-hit-29-year-high-as-iran-impasse-stokes-inflation-fears,2026-04-13 13:41:45
nikkei,,Vietnam's air pollution reality is clouded by falsified data,https://asia.nikkei.com/spotlight/environment/vietnam-s-air-pollution-reality-is-clouded-by-falsified-data,2026-04-13 13:41:45
nikkei,,India increases use of foreign players to move up electronics value chain,https://asia.nikkei.com/business/electronics/india-increases-use-of-foreign-players-to-move-up-electronics-value-chain,2026-04-13 10:37:46
nikkei,,Japan's long-term government bond yield hit a 29-year high,https://asia.nikkei.com/business/markets/japan-s-long-term-government-bond-yield-hit-a-29-year-high,2026-04-13 10:37:46
nikkei,,Oil jumps and Japan stocks slip as Trump threatens Hormuz blockade,https://asia.nikkei.com/business/markets/oil-jumps-and-japan-stocks-slip-as-trump-threatens-hormuz-blockade,2026-04-13 10:37:46
nikkei,,Japan's SMBC to launch $630m fund with Neuberger Berman,https://asia.nikkei.com/business/finance/japan-s-smbc-to-launch-630m-fund-with-neuberger-berman,2026-04-13 06:34:50
nikkei,,Indonesia's underperforming stock market faces credibility test,https://asia.nikkei.com/business/markets/trading-asia/indonesia-s-underperforming-stock-market-faces-credibility-test,2026-04-13 05:34:25
nikkei,,Malaysia is Asia's quiet overachiever,https://asia.nikkei.com/opinion/malaysia-is-asia-s-quiet-overachiever,2026-04-13 04:36:16
nikkei,,Toyota unveils new version of basketball-shooting AI robot,https://asia.nikkei.com/business/technology/toyota-unveils-new-version-of-basketball-shooting-ai-robot,2026-04-13 03:39:15
nikkei,,Japan's SoftBank launches unit to develop homegrown AI,https://asia.nikkei.com/business/technology/artificial-intelligence/japan-s-softbank-launches-unit-to-develop-homegrown-ai,2026-04-13 00:52:36
nikkei,,US-Iran deadlock leaves mediator Pakistan salvaging positives,https://asia.nikkei.com/spotlight/iran-tensions/iran-war/us-iran-deadlock-leaves-mediator-pakistan-salvaging-positives,2026-04-12 19:06:49
nikkei,,"To Lam visits China, Indian economic data, Guangzhou trade fair",https://asia.nikkei.com/spotlight/your-week-in-asia/to-lam-visits-china-indian-economic-data-guangzhou-trade-fair,2026-04-12 14:53:25
nikkei,,China's eel farmers face plummeting prices after extensive 2025 catch,https://asia.nikkei.com/business/food-beverage/china-s-eel-farmers-face-plummeting-prices-after-extensive-2025-catch,2026-04-12 14:53:25
nikkei,,China robotaxi firms eye Southeast Asia; Tesla pushes for US legal changes,https://asia.nikkei.com/business/transportation/china-robotaxi-firms-eye-southeast-asia-tesla-pushes-for-us-legal-changes,2026-04-12 10:32:27
nikkei,,India's coffee exporters squeezed as Iran conflict disrupts shipping,https://asia.nikkei.com/business/food-beverage/india-s-coffee-exporters-squeezed-as-iran-conflict-disrupts-shipping,2026-04-12 10:32:27
nikkei,,Wagyu exporters illicitly declare Hong Kong shipments as Cambodia-bound,https://asia.nikkei.com/spotlight/society/crime/wagyu-exporters-illicitly-declare-hong-kong-shipments-as-cambodia-bound,2026-04-12 10:32:27
nikkei,,Delving deep into Vietnam's Mekong Delta,https://asia.nikkei.com/life-arts/life/destinations/delving-deep-into-vietnam-s-mekong-delta,2026-04-12 07:33:48
nikkei,,Japan sticker trading craze engulfs girls and mothers in 'fierce scramble',https://asia.nikkei.com/business/business-trends/japan-sticker-trading-craze-engulfs-girls-and-mothers-in-fierce-scramble,2026-04-12 06:32:30
nikkei,,"US-Iran peace talks underway with Vance, Ghalibaf in Islamabad",https://asia.nikkei.com/spotlight/iran-tensions/iran-war/us-iran-peace-talks-underway-with-vance-ghalibaf-in-islamabad,2026-04-12 04:33:04
nikkei,,Emotional AI is here. We aren't ready,https://asia.nikkei.com/opinion/emotional-ai-is-here.-we-aren-t-ready,2026-04-12 04:33:04
nikkei,,"Japan homebuilders plan price hikes on higher pipe, paint costs",https://asia.nikkei.com/business/construction/japan-homebuilders-plan-price-hikes-on-higher-pipe-paint-costs,2026-04-12 03:34:45
nikkei,,Japan to rein in unauthorized work by foreign students,https://asia.nikkei.com/spotlight/japan-immigration/japan-to-rein-in-unauthorized-work-by-foreign-students,2026-04-11 23:55:53
nikkei,,"US-Iran talks begin after Vance, Ghalibaf arrive in Islamabad",https://asia.nikkei.com/spotlight/iran-tensions/iran-war/us-iran-talks-begin-after-vance-ghalibaf-arrive-in-islamabad,2026-04-11 19:30:16
nikkei,,Japanese board game company makes its pitch to the global market,https://asia.nikkei.com/business/media-entertainment/japanese-board-game-company-makes-its-pitch-to-the-global-market,2026-04-11 16:42:21
nikkei,,Malnourished Afghan minors trapped as two wars cut off supplies,https://asia.nikkei.com/politics/international-relations/afghanistan-turmoil/malnourished-afghan-minors-trapped-as-two-wars-cut-off-supplies,2026-04-11 14:00:57
nikkei,,Pakistan's $3.5bn loan repayment to UAE hints at cracks in ties,https://asia.nikkei.com/politics/international-relations/pakistan-s-3.5bn-loan-repayment-to-uae-hints-at-cracks-in-ties,2026-04-11 10:10:09
nikkei,,Japan pen maker Zebra aims to earn its stripes at the high end,https://asia.nikkei.com/business/consumer/japan-pen-maker-zebra-aims-to-earn-its-stripes-at-the-high-end,2026-04-11 06:37:33
nikkei,,"UK cosmetics maker Molton Brown pursues wealthy Thais, Vietnamese",https://asia.nikkei.com/business/consumer/uk-cosmetics-maker-molton-brown-pursues-wealthy-thais-vietnamese,2026-04-11 05:37:03
nikkei,,Thailand feels heat as Iran war sparks energy shock,https://asia.nikkei.com/spotlight/big-in-asia/thailand-feels-heat-as-iran-war-sparks-energy-shock,2026-04-11 05:37:03
nikkei,,Uniqlo growth propels Fast Retailing to Japan's No. 3 by market cap,https://asia.nikkei.com/business/retail/uniqlo-growth-propels-fast-retailing-to-japan-s-no.-3-by-market-cap,2026-04-11 04:37:01
nikkei,,Gas price surge kick-starts US demand for used EVs,https://asia.nikkei.com/business/automobiles/electric-vehicles/gas-price-surge-kick-starts-us-demand-for-used-evs,2026-04-11 04:37:01
nikkei,,Japan's independent power retailers halt corporate contracts as costs spike,https://asia.nikkei.com/business/energy/japan-s-independent-power-retailers-halt-corporate-contracts-as-costs-spike,2026-04-11 03:43:41
nikkei,,Trump's latest global tariffs challenged in federal court Friday,https://asia.nikkei.com/economy/trade-war/trump-tariffs/trump-s-latest-global-tariffs-challenged-in-federal-court-friday,2026-04-11 02:52:23
nikkei,,"Sumitomo Forestry bets big on US housing market, eyeing local majors",https://asia.nikkei.com/business/construction/sumitomo-forestry-bets-big-on-us-housing-market-eyeing-local-majors,2026-04-11 01:48:03
nikkei,,Japan to hike visa renewal fees to $440 for 5-year stay,https://asia.nikkei.com/spotlight/japan-immigration/japan-to-hike-visa-renewal-fees-to-440-for-5-year-stay,2026-04-11 01:48:03
nikkei,,Japan AI startup develops tool to combat academic espionage,https://asia.nikkei.com/business/technology/artificial-intelligence/japan-ai-startup-develops-tool-to-combat-academic-espionage,2026-04-11 01:48:03
nikkei,,Warren Buffett's Berkshire sells $1.7bn of yen bonds,https://asia.nikkei.com/business/markets/bonds/warren-buffett-s-berkshire-sells-1.7bn-of-yen-bonds,2026-04-11 00:51:36
nikkei,,"Iran conflict drives up food, transport prices across Southeast Asia",https://asia.nikkei.com/economy/iran-conflict-drives-up-food-transport-prices-across-southeast-asia,2026-04-11 00:51:36
nikkei,,JD.com founder to invest $2.9bn in China's yacht industry,https://asia.nikkei.com/business/companies/jd.com-founder-to-invest-2.9bn-in-china-s-yacht-industry,2026-04-10 23:53:34
nikkei,,US-Iran talks set for Saturday in Pakistan with Hormuz in focus,https://asia.nikkei.com/spotlight/iran-tensions/iran-war/us-iran-talks-set-for-saturday-in-pakistan-with-hormuz-in-focus,2026-04-10 19:57:33
nikkei,,Philippines to roll out new transport subsidies as Iran war risks endure,https://asia.nikkei.com/spotlight/iran-tensions/iran-war/philippines-to-roll-out-new-transport-subsidies-as-iran-war-risks-endure,2026-04-10 19:57:33
nikkei,,Iran war will force massive supply chain rethink: Shipper Mitsui OSK CEO,https://asia.nikkei.com/spotlight/iran-tensions/iran-war/iran-war-will-force-massive-supply-chain-rethink-shipper-mitsui-osk-ceo,2026-04-10 18:33:47
nikkei,,Trump's latest global tariffs face court challenge Friday,https://asia.nikkei.com/economy/trade-war/trump-tariffs/trump-s-latest-global-tariffs-face-court-challenge-friday,2026-04-10 17:08:38
nikkei,,Editor's Choice: Apple at 50 faces core innovation challenge,https://asia.nikkei.com/editor-s-picks/editor-in-chief-s-picks/editor-s-choice-apple-at-50-faces-core-innovation-challenge,2026-04-10 16:01:12
nikkei,,"Kazakhstan attracts Asian oil suitors, but export constraints hinder supply",https://asia.nikkei.com/business/energy/kazakhstan-attracts-asian-oil-suitors-but-export-constraints-hinder-supply,2026-04-10 16:01:12
nikkei,,"Cambodia's loan relief ends, fueling concerns over household debt",https://asia.nikkei.com/business/finance/cambodia-s-loan-relief-ends-fueling-concerns-over-household-debt,2026-04-10 16:01:12
nikkei,,South Korea vows clean break from era of state-chaebol collusion,https://asia.nikkei.com/editor-s-picks/interview/south-korea-vows-clean-break-from-era-of-state-chaebol-collusion,2026-04-10 16:01:12
nikkei,,Incoming Air India and IndiGo CEOs face need for reset amid struggles,https://asia.nikkei.com/business/transportation/incoming-air-india-and-indigo-ceos-face-need-for-reset-amid-struggles,2026-04-10 13:52:36
nikkei,,China factory prices log first rise in years as Iran war counters deflation,https://asia.nikkei.com/economy/china-factory-prices-log-first-rise-in-years-as-iran-war-counters-deflation,2026-04-10 11:51:11
nikkei,,Xi Jinping meets new face of Taiwan's opposition as US and Japan watch,https://asia.nikkei.com/politics/international-relations/taiwan-tensions/xi-jinping-meets-new-face-of-taiwan-s-opposition-as-us-and-japan-watch,2026-04-10 11:51:11
nikkei,,Japan's aging foreign population faces gaps in elder care,https://asia.nikkei.com/spotlight/japan-immigration/japan-s-aging-foreign-population-faces-gaps-in-elder-care,2026-04-10 11:51:11
nikkei,,Singapore's ComfortDelGro bets on robotaxis as next growth engine,https://asia.nikkei.com/editor-s-picks/interview/singapore-s-comfortdelgro-bets-on-robotaxis-as-next-growth-engine,2026-04-10 11:51:11
nikkei,,Developing Asia's growth to slow as Iran war sends oil prices soaring: ADB,https://asia.nikkei.com/economy/developing-asia-s-growth-to-slow-as-iran-war-sends-oil-prices-soaring-adb,2026-04-10 11:51:11
nikkei,,All-you-can-ride Japan Rail Pass price to go up in October,https://asia.nikkei.com/business/travel-leisure/all-you-can-ride-japan-rail-pass-price-to-go-up-in-october,2026-04-10 11:51:11
nikkei,,Japan's Sompo Care to recruit Indian caregivers for rival firms,https://asia.nikkei.com/spotlight/japan-immigration/japan-s-sompo-care-to-recruit-indian-caregivers-for-rival-firms,2026-04-10 06:06:03
nikkei,,"Sumitomo Electric to boost tungsten output 50%, reducing China dependence",https://asia.nikkei.com/business/companies/sumitomo-electric-to-boost-tungsten-output-50-reducing-china-dependence,2026-04-10 06:06:03
nikkei,,"Chinese airlines add thousands of Europe flights, shrugging off Iran war",https://asia.nikkei.com/business/travel-leisure/chinese-airlines-add-thousands-of-europe-flights-shrugging-off-iran-war,2026-04-10 05:09:27
nikkei,,"Saudi Arabia, emerging economies gain momentum in green hydrogen",https://asia.nikkei.com/business/energy/saudi-arabia-emerging-economies-gain-momentum-in-green-hydrogen,2026-04-10 05:09:27
nikkei,,Mitsubishi to receive $2.4bn Japan state loan for US gas supplier deal,https://asia.nikkei.com/business/energy/mitsubishi-to-receive-2.4bn-japan-state-loan-for-us-gas-supplier-deal,2026-04-10 04:12:41
nikkei,,Japanese regulator probes risks to major banks from private credit,https://asia.nikkei.com/business/finance/japanese-regulator-probes-risks-to-major-banks-from-private-credit,2026-04-10 04:12:41
nikkei,,"Japan retail investors make 25% of stock trades, highest in 12 years",https://asia.nikkei.com/business/markets/japan-retail-investors-make-25-of-stock-trades-highest-in-12-years,2026-04-10 03:06:30
nikkei,,Japan Rail Pass price to go up in October,https://asia.nikkei.com/business/travel-leisure/japan-rail-pass-price-to-go-up-in-october,2026-04-10 03:06:30
nikkei,,Japan's JFE Engineering to build waste-to-energy plants in India,https://asia.nikkei.com/spotlight/environment/japan-s-jfe-engineering-to-build-waste-to-energy-plants-in-india,2026-04-10 01:37:08
nikkei,,Japan's Inpex weighs shifting oil investment from Mideast to Southeast Asia,https://asia.nikkei.com/business/energy/japan-s-inpex-weighs-shifting-oil-investment-from-mideast-to-southeast-asia,2026-04-10 01:37:08
