domain,company,title,url,crawled_at
theinformation,,Tesla Discloses $2 Billion Deal for Unnamed AI Hardware Company,https://www.theinformation.com/briefings/tesla-discloses-2-billion-deal-unnamed-ai-hardware-company,2026-04-24 03:11:14
theinformation,,New Security Breaches at Anthropic and OpenAI Proved Mark Zuckerberg Right,https://www.theinformation.com/newsletters/ai-agenda/new-security-breaches-anthropic-openai-proved-mark-zuckerberg-right,2026-04-24 01:53:48
theinformation,,"Berkshire Hathaway, Chubb Win Approval to Drop AI Insurance Coverage",https://www.theinformation.com/articles/berkshire-hathaway-chubb-win-approval-drop-ai-insurance-coverage,2026-04-24 00:17:23
theinformation,,Elon Musk Strikes Unusually Cautious Tone on Tesla Call,https://www.theinformation.com/newsletters/the-briefing/elon-musk-strikes-unusually-cautious-tone-tesla-call,2026-04-24 00:17:23
theinformation,,Tesla Revenue Grew 16% in First Quarter,https://www.theinformation.com/briefings/tesla-revenue-grew-16-first-quarter,2026-04-23 18:53:23
theinformation,,How CoreWeave Seduced the Bond Market,https://www.theinformation.com/newsletters/the-information-finance/coreweave-seduced-bond-market,2026-04-23 13:30:43
theinformation,,ServiceNow Stock Craters As Armis Acquisition Creates Profit ‘Headwinds’,https://www.theinformation.com/briefings/servicenow-stock-craters-armis-acquisition-creates-profit-headwinds,2026-04-23 10:35:10
theinformation,,What xAI and OpenAI Should Buy Next,https://www.theinformation.com/newsletters/the-weekend/xai-openai-buy-next,2026-04-23 10:35:10
theinformation,,OpenClaw Struggles to Grow Up After Overnight Success,https://www.theinformation.com/articles/openclaw-struggles-grow-overnight-success,2026-04-23 06:47:37
theinformation,,Adobe Announces New Stock Buyback,https://www.theinformation.com/briefings/adobe-announces-new-stock-buyback,2026-04-23 03:47:03
theinformation,,Google Announces New TPUs for Training and Inference,https://www.theinformation.com/briefings/google-announces-new-tpus-training-inference,2026-04-22 22:15:36
theinformation,,"Tencent, Alibaba in Talks to Invest in DeepSeek at $20 Billion-Plus Valuation",https://www.theinformation.com/articles/tencent-alibaba-talks-invest-deepseek-20-billion-plus-valuation,2026-04-22 20:13:30
theinformation,,Anthropic Investigates Unauthorized Mythos Use,https://www.theinformation.com/briefings/anthropic-investigates-unauthorized-mythos-use,2026-04-22 20:13:30
theinformation,,Snap CFO to Leave,https://www.theinformation.com/briefings/snap-cfo-leave,2026-04-22 13:48:22
theinformation,,Microsoft Cuts Xbox Game Subscription Price 23%,https://www.theinformation.com/briefings/microsoft-cuts-xbox-game-subscription-price-23,2026-04-22 13:48:22
theinformation,,SpaceX Says it Can Buy Cursor for $60 Billion Later This Year,https://www.theinformation.com/briefings/spacex-says-can-buy-cursor-60-billion-later-year,2026-04-22 13:48:22
theinformation,,What SpaceX’s Cursor Deal Says About xAI,https://www.theinformation.com/newsletters/the-briefing/spacexs-cursor-deal-says-xai,2026-04-22 10:36:20
theinformation,,The Bankers Behind SpaceX’s “Project Apex” IPO,https://www.theinformation.com/newsletters/dealmaker/bankers-behind-spacexs-project-apex-ipo,2026-04-22 10:36:20
theinformation,,Adobe Says It Will Start Charging For AI Agents Only When They Work,https://www.theinformation.com/newsletters/applied-ai/adobe-says-will-start-charging-ai-agents-work,2026-04-22 06:08:18
theinformation,,SpaceX Debt Jumped to $23 Billion Last Year,https://www.theinformation.com/articles/spacex-debt-jumped-23-billion-last-year,2026-04-22 04:03:17
theinformation,,OpenAI Launches Cost-Per-Click ChatGPT Ads,https://www.theinformation.com/briefings/openai-launches-cost-per-click-chatgpt-ads,2026-04-22 04:03:17
theinformation,,Exclusive: Kalshi to Launch Crypto Trading With Perpetual Futures,https://www.theinformation.com/briefings/exclusive-kalshi-launch-crypto-trading-perpetual-futures,2026-04-22 02:39:18
theinformation,,DoorDash to Offer Stablecoin Payments to Drivers Using Tempo,https://www.theinformation.com/briefings/doordash-offer-stablecoin-payments-drivers-using-tempo,2026-04-22 01:01:30
theinformation,,Anthropic’s ID Verification Imperils Chinese Founders,https://www.theinformation.com/newsletters/ai-agenda/anthropics-id-verification-imperils-chinese-founders,2026-04-21 23:52:25
theinformation,,Mercado Libre Is Growing 30%-Plus a Year: Its Stock Is Too Cheap,https://www.theinformation.com/articles/mercado-libre-growing-30-plus-year-stock-cheap,2026-04-21 23:52:25
theinformation,,China’s Moonshot AI Launches New Coding Model Ahead of DeepSeek’s V4 Release,https://www.theinformation.com/briefings/chinas-moonshot-ai-launches-new-coding-model-ahead-deepseeks-v4-release,2026-04-21 22:16:01
theinformation,,AI Data Center Startup Phononic Discusses Multi-Billion Dollar Valuation in Possible Sale,https://www.theinformation.com/articles/ai-data-center-startup-phononic-discusses-1-5-billion-valuation-possible-sale,2026-04-21 17:59:56
theinformation,,"Musk Bought $1.4 Billion SpaceX Shares, Helping Boost Control",https://www.theinformation.com/articles/musk-bought-1-4-billion-spacex-shares-helping-boost-control,2026-04-21 16:17:23
theinformation,,Andreessen Backs X-based Media Startup,https://www.theinformation.com/briefings/andreessen-backs-x-based-media-startup,2026-04-21 14:02:45
theinformation,,Apple’s CEO Switch; Amazon’s AI Hedge,https://www.theinformation.com/newsletters/the-briefing/apples-ceo-switch-amazons-ai-hedge,2026-04-21 14:02:45
theinformation,,Amazon to Invest Up to $25 Billion in Anthropic,https://www.theinformation.com/briefings/amazon-invest-25-billion-anthropic,2026-04-21 11:51:13
theinformation,,Microsoft Raises Prices For Some GitHub AI Coding Features as Demand Surges,https://www.theinformation.com/briefings/microsoft-raises-prices-github-ai-coding-features-demand-surges,2026-04-21 10:49:33
theinformation,,"Three Big Questions for Apple’s Next CEO, John Ternus",https://www.theinformation.com/articles/three-big-questions-apples-next-ceo-john-ternus,2026-04-21 10:49:33
theinformation,,Blue Origin Successfully Lands New Glenn Rocket Booster,https://www.theinformation.com/briefings/blue-origin-successfully-lands-new-glenn-rocket-booster,2026-04-21 07:09:09
theinformation,,The Startup Trying to Tame Accounting Chaos Behind AI Data Centers,https://www.theinformation.com/newsletters/ai-infrastructure/startup-trying-tame-accounting-chaos-behind-ai-data-centers,2026-04-21 05:11:22
theinformation,,OpenAI Takes Aim at Google with New Image Model,https://www.theinformation.com/newsletters/ai-agenda/openai-takes-aim-google-new-image-model,2026-04-21 04:10:36
theinformation,,The Electric: Repurposed EV Batteries Are a New Power Source in AI Data Centers,https://www.theinformation.com/newsletters/the-electric/repurposed-ev-batteries-new-power-source-ai-data-centers,2026-04-21 03:14:45
theinformation,,Polymarket Discusses Funding at a Roughly $15 Billion Valuation,https://www.theinformation.com/briefings/polymarket-discusses-funding-roughly-15-billion-valuation,2026-04-21 01:57:58
theinformation,,Google Creates Strike Team to Improve Coding Models,https://www.theinformation.com/articles/google-creates-strike-team-improve-coding-models,2026-04-20 23:05:27
theinformation,,Vercel Confirms Security Breach,https://www.theinformation.com/briefings/vercel-confirms-breach-hackers-list-stolen-data-2m,2026-04-20 21:29:18
theinformation,,NSA Uses Anthropic’s Mythos Despite Pentagon Blacklist,https://www.theinformation.com/briefings/nsa-uses-anthropics-mythos-despite-pentagon-blacklist,2026-04-20 21:29:18
theinformation,,Lawyers for Musk Propose Dropping Fraud Claims Against OpenAI,https://www.theinformation.com/briefings/lawyers-musk-propose-dropping-fraud-claims-openai,2026-04-20 18:15:34
theinformation,,China’s 10 Most Important Chip Design Firms,https://www.theinformation.com/articles/chinas-10-important-chip-design-firms,2026-04-20 16:07:08
theinformation,,Polymarket in Talks to Raise Money at About $15 Billion Valuation,https://www.theinformation.com/articles/polymarket-talks-raise-money-15-billion-valuation,2026-04-20 13:41:24
theinformation,,Anthropic Has Received Investor Interest at $800 Billion Valuation,https://www.theinformation.com/briefings/anthropic-received-investor-interest-800-billion-valuation,2026-04-20 13:41:24
theinformation,,Adobe and Google Cloud Head to Vegas,https://www.theinformation.com/newsletters/the-briefing/adobe-google-cloud-head-vegas,2026-04-20 13:41:24
theinformation,,"Andreessen Horowitz, Thrive Capital to Co-Lead Cursor Investment at $50 Billion Valuation",https://www.theinformation.com/briefings/andreessen-horowitz-thrive-capital-co-lead-cursor-investment-50-billion-valuation,2026-04-20 10:23:11
theinformation,,Dylan Patel’s SemiAnalysis Projects Over $100 Million In 2026 Revenue,https://www.theinformation.com/briefings/dylan-patels-semianalysis-projects-100-million-2026-revenue,2026-04-19 23:06:42
theinformation,,Google in Talks With Marvell to Build New AI Chips for Inference,https://www.theinformation.com/articles/google-talks-marvell-build-new-ai-chips-inference,2026-04-19 23:06:42
theinformation,,Meta Paid Broadcom $2.3 Billion in 2025,https://www.theinformation.com/briefings/meta-paid-broadcom-2-3-billion-2025,2026-04-19 22:09:49
theinformation,,Anthropic CEO Visits White House,https://www.theinformation.com/briefings/anthropic-ceo-visits-white-house,2026-04-19 19:58:36
theinformation,,Anthropic’s CFO Wields Power Behind the Scenes,https://www.theinformation.com/articles/anthropics-cfo-wields-power-behind-scenes,2026-04-19 05:35:24
theinformation,,Accel Raises $5 Billion for Late-Stage Investments,https://www.theinformation.com/briefings/accel-raises-5-billion-late-stage-investments,2026-04-19 01:05:42
theinformation,,How Dylan Patel and SemiAnalysis Grabbed Sway in Silicon Valley,https://www.theinformation.com/articles/dylan-patel-semianalysis-grabbed-sway-silicon-valley,2026-04-18 12:55:33
theinformation,,"China’s Regulator Slaps $515 Million Fines on PDD, Other Food Delivery Platforms",https://www.theinformation.com/briefings/chinas-regulator-slaps-515-million-fines-pdd-food-delivery-platforms,2026-04-18 12:55:33
theinformation,,Kevin Weil and Sora Head to Leave OpenAI,https://www.theinformation.com/briefings/kevin-weil-sora-head-leave-openai,2026-04-18 10:23:22
theinformation,,Meta Eyes Layoffs of 10% of Company Starting in May,https://www.theinformation.com/briefings/meta-eyes-layoffs-10-company-starting-may,2026-04-18 07:38:57
theinformation,,Anthropic Launches Claude Design,https://www.theinformation.com/briefings/anthropic-launches-claude-design,2026-04-18 06:38:40
theinformation,,Police Tech Startup Flock Safety Valued at $8.4 Billion Amid Civic Protests,https://www.theinformation.com/articles/police-tech-startup-flock-safety-valued-8-4-billion-amid-civic-protests,2026-04-18 03:37:02
theinformation,,"Alibaba Becomes Selective with Open-Source Models, New Release Shows",https://www.theinformation.com/briefings/alibaba-becomes-selective-open-source-models-new-release-shows,2026-04-18 02:11:47
theinformation,,"China’s DeepSeek is Raising Money for First Time, At $10 Billion-Plus Valuation",https://www.theinformation.com/articles/chinas-deepseek-raising-money-first-time-10-billion-plus-valuation,2026-04-18 00:01:03
theinformation,,Marc Lore’s Wonder Preps a Pre-IPO Round,https://www.theinformation.com/newsletters/dealmaker/marc-lores-wonder-preps-pre-ipo-round,2026-04-17 22:40:39
theinformation,,Meta Raises VR Headset Prices by as Much as $100,https://www.theinformation.com/briefings/meta-raises-vr-headset-prices-100,2026-04-17 21:19:10
theinformation,,"Netflix Reports 16% First Quarter Growth, as Hastings Leaves Board",https://www.theinformation.com/briefings/netflix-reports-16-first-quarter-growth-hastings-leaves-board,2026-04-17 16:12:35
theinformation,,Can OpenAI’s ChatGPT Ad Ambitions Add Up?,https://www.theinformation.com/articles/can-openais-chatgpt-ad-ambitions-add,2026-04-17 16:12:35
theinformation,,Deutsche Börse Acquires $200 Million Stake in Kraken,https://www.theinformation.com/briefings/deutsche-borse-acquires-200-million-stake-kraken,2026-04-17 16:12:35
theinformation,,"Cerebras Prepares Public Listing, Eyes $35 Billion-Plus Valuation",https://www.theinformation.com/briefings/cerebras-prepares-public-listing-eyes-35-billion-plus-valuation,2026-04-17 14:03:12
theinformation,,TSMC Raises Revenue Forecast as AI Chip Demand Surges,https://www.theinformation.com/briefings/tsmc-raises-revenue-forecast-ai-chip-demand-surges,2026-04-17 14:03:12
theinformation,,TSMC’s Strong Results is One More Bullish AI Sign,https://www.theinformation.com/newsletters/the-briefing/tsmcs-strong-results-one-bullish-ai-sign,2026-04-17 14:03:12
theinformation,,"OpenAI to Spend More Than $20 Billion on Cerebras Chips, Receive Equity Stake",https://www.theinformation.com/articles/openai-spend-20-billion-cerebras-chips-receive-equity-stake,2026-04-17 11:51:12
theinformation,,LinkedIn’s AI Agent Product Becomes a Surprise Bright Spot for Microsoft,https://www.theinformation.com/newsletters/applied-ai/linkedins-ai-agent-product-becomes-surprise-bright-spot-microsoft,2026-04-17 04:10:17
theinformation,,xAI to Rent Computing Power to Cursor,https://www.theinformation.com/briefings/xai-rent-computing-power-cursor,2026-04-17 03:13:32
theinformation,,OpenAI Prepares to Launch Cost-Per-Click Ads In Coming Days,https://www.theinformation.com/briefings/openai-prepares-launch-cost-per-click-ads-coming-days,2026-04-16 22:56:02
theinformation,,Google and Pentagon Discuss Classified AI Deal as Company Rebuilds Military Ties,https://www.theinformation.com/articles/google-pentagon-discuss-classified-ai-deal-company-rebuilds-military-ties,2026-04-16 22:56:02
theinformation,,The Hidden Costs of AI Shopping Payments,https://www.theinformation.com/articles/ai-buying-bots-driving-refunds-risks-adyen-executive,2026-04-16 22:56:02
theinformation,,Figma’s Apple Moment; Allbirds’ AI Pivot,https://www.theinformation.com/newsletters/the-briefing/figmas-apple-moment-allbirds-ai-pivot,2026-04-16 20:42:42
theinformation,,Crypto Billionaire Justin Sun Labels Trump-Linked Crypto Vote a Scam,https://www.theinformation.com/briefings/crypto-billionaire-justin-sun-labels-trump-linked-crypto-vote-scam,2026-04-16 16:13:08
theinformation,,The Enigma of the Data Labeling Startup Explosion,https://www.theinformation.com/newsletters/ai-agenda/enigma-data-labeling-startup-explosion,2026-04-16 10:28:58
theinformation,,China’s Probe of Meta’s Manus Purchase Sends Startups Scrambling,https://www.theinformation.com/newsletters/ai-agenda/chinas-probe-metas-manus-purchase-sends-startups-scrambling,2026-04-16 08:06:47
theinformation,,Exclusive: Meta Reorganizes Reality Labs To ‘Execute Faster’,https://www.theinformation.com/briefings/exclusive-meta-reorganizes-reality-labs-execute-faster,2026-04-16 07:10:34
theinformation,,Apple Sends Siri Staffers to Coding ‘Bootcamp’ in Latest Shakeup For Organization,https://www.theinformation.com/articles/apple-sends-siri-staffers-coding-bootcamp-latest-shakeup-organization,2026-04-16 07:10:34
theinformation,,New Salesforce Tool Connects Third-Party Agents With Its Customer Data,https://www.theinformation.com/briefings/new-salesforce-tool-connects-third-party-agents-customer-data,2026-04-16 07:10:34
theinformation,,I Helped Pick Stocks for the Dow. I’m Watching the SpaceX IPO Carefully,https://www.theinformation.com/newsletters/the-information-finance/helped-pick-stocks-dow-watching-spacex-ipo-carefully,2026-04-16 06:10:48
theinformation,,Snap Lays Off 16% of Workforce,https://www.theinformation.com/briefings/snap-lays-16-workforce,2026-04-16 04:26:39
theinformation,,Anthropic Exec Leaves Figma Board,https://www.theinformation.com/briefings/anthropic-exec-leaves-figma-board,2026-04-16 03:17:18
theinformation,,Billion Dollar Grüns Sale Gives Consumer Investors Hope,https://www.theinformation.com/newsletters/dealmaker/billion-dollar-gruns-sale-gives-consumer-investors-hope,2026-04-16 00:04:57
theinformation,,Allbirds to Pivot to AI Chips,https://www.theinformation.com/briefings/allbirds-pivot-ai-chips,2026-04-15 22:54:20
theinformation,,Novartis CEO Joins Anthropic’s Board,https://www.theinformation.com/briefings/novartis-ceo-joins-anthropics-board,2026-04-15 22:54:20
theinformation,,"OpenAI Plans New Pricing for ChatGPT Ads, Explores Other Upgrades",https://www.theinformation.com/articles/openai-plans-new-pricing-chatgpt-ads-explores-upgrades,2026-04-15 22:54:20
theinformation,,"ByteDance Launches Seedance 2.0 Globally, Excluding the U.S.",https://www.theinformation.com/briefings/bytedance-launches-seedance-2-0-globally-excluding-u-s,2026-04-15 21:27:03
theinformation,,What Amazon’s Globalstar Purchase Means for SpaceX,https://www.theinformation.com/newsletters/the-briefing/amazons-globalstar-purchase-means-spacex,2026-04-15 17:03:23
theinformation,,Anthropic Changes Pricing to Bill Firms Based on AI Use Amid Compute Crunch,https://www.theinformation.com/articles/anthropic-changes-pricing-bill-firms-based-ai-use-amid-compute-crunch,2026-04-15 09:39:14
theinformation,,Crypto Firms Seek Access to Anthropic’s Mythos While Shoring Up Defenses,https://www.theinformation.com/articles/crypto-firms-seek-access-anthropics-mythos-shoring-defenses,2026-04-15 06:44:44
theinformation,,"Dell, HP Shares Drop After Nvidia Denies Takeover Report",https://www.theinformation.com/briefings/dell-hp-shares-drop-nvidia-denies-takeover-report,2026-04-15 06:44:44
theinformation,,Exclusive: Meta AI Infrastructure Executive Departs,https://www.theinformation.com/briefings/exclusive-meta-ai-infrastructure-executive-departs,2026-04-15 06:44:44
theinformation,,"Exclusive: Anthropic Preps Opus 4.7 Model, AI Design Tool",https://www.theinformation.com/briefings/exclusive-anthropic-preps-opus-4-7-model-ai-design-tool,2026-04-15 03:48:50
theinformation,,Uber CTO Shows How Claude Code Can Blow Up AI Budgets,https://www.theinformation.com/newsletters/applied-ai/uber-cto-shows-claude-code-can-blow-ai-budgets,2026-04-15 03:48:50
theinformation,,"Amazon to Pay $11.5 Billion for Globalstar, Signs Apple iPhone Deal",https://www.theinformation.com/briefings/amazon-pay-11-5-billion-globalstar-signs-apple-iphone-deal,2026-04-15 00:40:36
theinformation,,Polymarket Reverses Course on Startups That Piggyback on Insider Trades,https://www.theinformation.com/articles/polymarket-reverses-course-startups-piggyback-insider-trades,2026-04-14 23:13:26
theinformation,,What SpaceX’s Numbers Do and Don’t Tell Us,https://www.theinformation.com/newsletters/the-briefing/spacexs-numbers-tell,2026-04-14 15:07:43
theinformation,,New SpaceX Numbers Show Reliance on Starlink,https://www.theinformation.com/articles/new-spacex-numbers-show-reliance-starlink,2026-04-14 13:23:39
theinformation,,Thinking Machines Hires Founders of Personalized AI Startup Workshop Labs,https://www.theinformation.com/briefings/thinking-machines-hires-founders-personalized-ai-startup-workshop-labs,2026-04-14 13:23:39
theinformation,,"The Electric: In the U.S. and China, Exaggerated Claims of Solid State Batteries",https://www.theinformation.com/newsletters/the-electric/electric-u-s-china-exaggerated-claims-solid-state-batteries,2026-04-14 13:23:39
theinformation,,"Handshake, Mercor Revenue Surges on Demand for Human Contractors to Train AI",https://www.theinformation.com/articles/handshake-mercor-revenue-surges-demand-human-contractors-train-ai,2026-04-14 10:31:16
theinformation,,Tether Hires JPMorgan Executive for U.S. Stablecoin Expansion,https://www.theinformation.com/briefings/tether-hires-jpmorgan-executive-u-s-stablecoin-expansion,2026-04-14 10:31:16
theinformation,,"‘Reinforcement Learning Gym’ Startup, Buoyed by Labs’ Appetite For Training Data, Reaches $750 Million Valuation",https://www.theinformation.com/newsletters/ai-agenda/reinforcement-learning-gym-startup-buoyed-labs-appetite-training-data-reaches-750-million-valuation,2026-04-14 03:47:30
theinformation,,"OpenAI Memo Cites “Staggering” Demand for Joint AWS Product, Says Microsoft “Limited” Business",https://www.theinformation.com/briefings/openai-memo-cites-staggering-demand-joint-aws-product-says-microsoft-limited-business,2026-04-14 02:01:15
theinformation,,Microsoft Slowed AI Spending. Now It’s Playing Catchup,https://www.theinformation.com/newsletters/ai-infrastructure/microsoft-slowed-ai-spending-now-playing-catchup,2026-04-14 02:01:15
theinformation,,Microsoft Plots New Copilot Features Inspired by OpenClaw,https://www.theinformation.com/articles/microsoft-plots-new-copilot-features-inspired-openclaw,2026-04-13 23:01:49
theinformation,,Perplexity’s ARR Rises to $500 Million,https://www.theinformation.com/briefings/perplexitys-arr-rises-500-million,2026-04-13 23:01:49
theinformation,,Netflix on Deck This Week; Pressure on Software Stocks Intensifies,https://www.theinformation.com/newsletters/the-briefing/netflix-deck-week-pressure-software-stocks-intensifies,2026-04-13 18:13:33
theinformation,,Altman Addresses Home Attack,https://www.theinformation.com/briefings/altman-addresses-home-attack,2026-04-13 13:41:45
theinformation,,Atlassian and Figma Lead the R&D Arms Race,https://www.theinformation.com/articles/atlassian-figma-lead-r-d-arms-race,2026-04-13 06:34:50
theinformation,,OpenAI Developing ‘Garlic’ Model to Counter Google’s Recent Gains,https://www.theinformation.com/newsletters/ai-agenda/openai-developing-garlic-model-counter-googles-recent-gains,2026-04-13 03:39:15
theinformation,,xAI Spending Pushed SpaceX to a Nearly $5 Billion Loss,https://news.google.com/rss/articles/CBMingFBVV95cUxQTUVTcUV5eDl6Sm1vLXNMNGl4SVFxLXMtWUdnX2RkMFBGYzd4S0FnWGIyVEVIallEVXctV3pVcnZDWld1RFk5WWFOWndpZW5OeDMxUzdsN1N6a2pUZnFiczVOTmZHOFY4NVl2WDJZbFRvbGJTSmJIYl9VX3NfaG1rRmZoYVNNSldwbG1Wbkl4Ylg3R3M3R1ZBVXZXWG5KZw?oc=5,2026-04-13 01:35:07
theinformation,,Exclusive: Mercor Hit Over $1 Billion in Annualized Gross Revenue Before Breach,https://news.google.com/rss/articles/CBMingFBVV95cUxNd3AzUERjeEVtMllhbVVGR2ZuaE1ZbjlZS2pPWDF4dVRCX3F3ckNTeGJXbHR0Y3pKNk5zWEdsbkYyNXB6dFg2OG1QeXprRmdUTmo2dVB1MEJoU1V2RXRPaEt3TEpsaFV6ODlraXNiaC1Vc3FUaVZtTlh6V1VsaVRYc19aRkg4RktxZ09OV3BsdDlkd0hkMk55aWo3dWp4dw?oc=5,2026-04-13 01:35:07
theinformation,,Why SpaceX Has an Uphill Battle Growing Starlink Mobile,https://news.google.com/rss/articles/CBMijAFBVV95cUxNdHJTLUJBcGxpUGJiS1RRTnMtMnVfU2RSS1ltX2NRd2ZFWlAycWtPR0FXRVhlOHc1OU5qWlVhTmlxQ2wyYWdPQjlYWjVGbXM3cUZlWnVZczNSVjdyTTNZSFNKYllnZC1VS0JQcXBUWWJUbGtidkhMS2xhUVBMWVowd0FJcnJOTjJEc21mZg?oc=5,2026-04-13 01:35:07
theinformation,,OpenAI’s Never-Ending Soap Opera,https://news.google.com/rss/articles/CBMikAFBVV95cUxPdS1EZ2U5UEo0azZJWTc1dHpWYk1MNndBUmtXSU9QeHBPd1BKRHBXZGhiYkE3SHlzeGY5YXRnWWJHSkxkRnR4WVVKMkFScC1rLWQzU3EtSjNSeVdjOXFZRzZpMXE5Y3ZyUzU5c2tJY0xKZDBrQ0t3Umdlb1E1UVNhMzQyRkIySERwTE91WGRmdG4?oc=5,2026-04-13 01:35:07
theinformation,,"Silicon Valley, Ready to Laugh Again?",https://www.theinformation.com/newsletters/the-weekend/silicon-valley-ready-laugh,2026-04-12 13:23:25
theinformation,,The ‘Tokenmaxxing’ Tide May Already Be Turning,https://www.theinformation.com/articles/tokenmaxxing-tide-may-turning,2026-04-12 10:32:27
theinformation,,CoreWeave Strikes Multi-Year Deal with Anthropic,https://www.theinformation.com/briefings/coreweave-strikes-multi-year-deal-anthropic,2026-04-12 10:32:27
theinformation,,How a Self-Taught Programmer Became the Father of Claude Code,https://www.theinformation.com/articles/self-taught-programmer-became-father-claude-code,2026-04-12 07:33:48
theinformation,,"Tesla Considers Producing Smaller, Cheaper SUV",https://www.theinformation.com/briefings/tesla-considers-producing-smaller-cheaper-suv,2026-04-12 05:32:37
theinformation,,‘Tokenmaxxing’ and the AI Margin Squeeze,https://www.theinformation.com/articles/tokenmaxxing-ai-margin-squeeze,2026-04-11 19:30:16
theinformation,,OpenAI Stargate Execs to Join Meta’s New Compute Unit,https://www.theinformation.com/briefings/openai-stargate-execs-join-metas-new-compute-unit,2026-04-11 18:33:38
theinformation,,Oracle Names CFO,https://www.theinformation.com/briefings/oracle-names-cfo,2026-04-11 12:33:45
theinformation,,Cisco in Talks to Buy AI Security Startup Astrix for at Least $250 Million,https://www.theinformation.com/articles/cisco-talks-buy-ai-security-startup-astrix-least-250-million,2026-04-11 07:35:06
theinformation,,"Powell, Bessent Said to Invite Bank Leaders to Discuss Anthropic’s Mythos",https://www.theinformation.com/briefings/powell-bessent-said-invite-bank-leaders-discuss-anthropics-mythos,2026-04-11 02:52:23
theinformation,,SK Hynix Is the Overlooked Memory Chip Maker,https://www.theinformation.com/articles/sk-hynix-overlooked-memory-chip-maker,2026-04-11 00:51:36
theinformation,,Google Will Use Intel Chips in Data Centers,https://www.theinformation.com/briefings/google-will-use-intel-chips-data-centers,2026-04-10 21:09:13
theinformation,,Meta Expands Cloud Deals With CoreWeave to $35 Billion through 2032,https://www.theinformation.com/briefings/meta-expands-cloud-deals-coreweave-35-billion-2032,2026-04-10 21:09:13
theinformation,,Anthropic Considers Designing its Own Chip,https://www.theinformation.com/briefings/anthropic-considers-designing-chip,2026-04-10 18:33:47
theinformation,,OpenAI Tweaks AI Coding Agent Pricing Amid Rising Use,https://www.theinformation.com/briefings/openai-tweaks-ai-coding-agent-pricing-amid-rising-use,2026-04-10 17:08:38
theinformation,,Exclusive: OpenAI Data Center Leaders Depart,https://www.theinformation.com/briefings/exclusive-openai-stargate-exec-peter-hoeschele-leaves-company,2026-04-10 17:08:38
