domain,company,title,url,crawled_at
theinformation,,The Electric: High Gas Prices Are Giving Chinese EV Makers Even Greater Advantage,https://www.theinformation.com/newsletters/the-electric/electric-high-gas-prices-giving-chinese-ev-makers-greater-advantage,2026-04-10 16:01:12
theinformation,,OpenAI Stargate Leaders Depart in Latest Shakeup to Data Center Strategy,https://www.theinformation.com/articles/openai-stargate-leaders-depart-latest-shakeup-data-center-strategy,2026-04-10 13:52:36
theinformation,,"OpenAI, Forecasts and Guesses",https://www.theinformation.com/newsletters/the-briefing/openai-forecasts-guesses,2026-04-10 13:52:36
theinformation,,"At HumanX, Anthropic Stokes AI Optimism",https://www.theinformation.com/newsletters/dealmaker/humanx-anthropic-stokes-ai-optimism,2026-04-10 13:52:36
theinformation,,CPU Startup SiFive Raises $400 Million,https://www.theinformation.com/briefings/cpu-startup-sifive-raises-400-million,2026-04-10 13:52:36
theinformation,,SpaceX Posted Nearly $5 Billion Loss Last Year from AI Spending,https://www.theinformation.com/articles/spacex-posted-nearly-5-billion-loss-last-year-ai-spending,2026-04-10 11:51:11
theinformation,,"Even Without Mythos, Researchers Say AI is Getting Scary Good at Hacking",https://www.theinformation.com/newsletters/applied-ai/without-mythos-researchers-say-ai-getting-scary-good-hacking,2026-04-10 08:01:28
theinformation,,Amazon Considers Selling AI Chips Beyond AWS,https://www.theinformation.com/briefings/amazon-considers-selling-ai-chips-beyond-aws,2026-04-10 07:09:08
theinformation,,The Startup Building Code Management Software for ‘Tokenmaxxers’,https://www.theinformation.com/newsletters/ai-agenda/startup-building-code-management-software-tokenmaxxers,2026-04-10 05:09:27
theinformation,,Exclusive: Meta Reassigns Engineers to Improve AI Models,https://www.theinformation.com/briefings/exclusive-meta-reassigns-engineers-improve-ai-models,2026-04-10 05:09:27
theinformation,,SpaceX Woos Investors As C-Suite Shakeups Continue,https://www.theinformation.com/articles/spacex-woos-investors-c-suite-shakeups-continue,2026-04-10 04:12:41
theinformation,,Exclusive: Former Andreessen General Partner Midha Raises $1.3 Billion,https://www.theinformation.com/briefings/exclusive-former-andreessen-general-partner-midha-raises-1-3-billion,2026-04-10 04:12:41
theinformation,,Exclusive: Mercor Hit Over $1 Billion in Annualized Revenue Before Breach,https://www.theinformation.com/briefings/exclusive-mercor-hit-1-billion-annualized-revenue-breach,2026-04-10 03:06:30
theinformation,,The $3 Billion AI Medicare Broker Backed By Two Vice Presidents,https://www.theinformation.com/newsletters/ai-agenda/3-billion-ai-medicare-broker-backed-two-vice-presidents,2026-04-10 01:37:08
theinformation,,Alibaba Anonymously Launches New AI Video Model,https://www.theinformation.com/briefings/alibaba-anonymously-launches-new-ai-video-model,2026-04-09 22:04:48
theinformation,,OpenAI Forecasts Advertising to Hit $102 billion by 2030,https://www.theinformation.com/articles/openai-forecasts-advertising-hit-102-billion-2030,2026-04-09 22:04:48
theinformation,,D.C. Court Denies Anthropic Motion to Stay Pentagon Blacklisting,https://www.theinformation.com/briefings/d-c-court-denies-anthropic-motion-stay-pentagon-blacklisting,2026-04-09 19:59:02
theinformation,,Inside OpenAI’s Scramble to Get Computing Power After Stargate Stalled,https://www.theinformation.com/articles/inside-openais-scramble-get-computing-power-stargate-stalled,2026-04-09 16:22:07
theinformation,,Meta Tries to Light a Fire in AI Market,https://www.theinformation.com/newsletters/the-briefing/meta-tries-light-fire-ai-market,2026-04-09 14:57:23
theinformation,,Workday CTO Joins Anthropic Amid Startup’s Push to Build HR Apps,https://www.theinformation.com/briefings/workday-cto-joins-anthropic-amid-startups-push-build-hr-apps,2026-04-09 10:24:02
theinformation,,Nebius in Talks to Buy Israeli AI Startup AI21 After Nvidia Deal Fizzles,https://www.theinformation.com/articles/nebius-talks-buy-israeli-ai-startup-ai21-nvidia-deal-fizzles,2026-04-09 07:08:00
theinformation,,Meta Unveils New AI Models,https://www.theinformation.com/briefings/meta-unveils-new-ai-models,2026-04-09 05:13:37
theinformation,,Nvidia Worth $22 Trillion? This Old-School Financial Model Says Yes.,https://www.theinformation.com/newsletters/the-information-finance/nvidia-worth-22-trillion-old-school-financial-model-says-yes,2026-04-09 04:08:20
theinformation,,Alibaba Streamlines Responsibilities for AI Executive,https://www.theinformation.com/briefings/alibaba-streamlines-responsibilities-ai-executive,2026-04-09 03:15:17
theinformation,,Meta Shutters Internal AI Token Leaderboard,https://www.theinformation.com/briefings/meta-shutters-internal-ai-token-leaderboard,2026-04-09 01:40:27
theinformation,,The Information,https://www.theinformation.com/,2026-04-09 00:14:29
theinformation,,Polygon Labs in Talks to Raise Up to $100 Million for Payments Business,https://www.theinformation.com/articles/polygon-labs-talks-raise-100-million-payments-business,2026-04-08 22:53:21
theinformation,,Newsletters,https://www.theinformation.com/newsletters,2026-04-08 22:53:21
theinformation,,AWS CEO Says Claude Code Won’t Replace SaaS,https://www.theinformation.com/briefings/aws-ceo-says-claude-code-replace-saas,2026-04-08 15:19:25
theinformation,,Intel Says It’s Joining SpaceX and Tesla ‘Terafab’ Project,https://www.theinformation.com/briefings/intel-says-joining-spacex-tesla-terafab-project,2026-04-08 15:19:25
theinformation,,Anthropic’s Revenue Growth Suggests OpenAI Is Overvalued,https://www.theinformation.com/newsletters/the-briefing/anthropics-revenue-growth-suggests-openai-overvalued,2026-04-08 13:44:10
theinformation,,The Math Behind Anthropic’s Mad Revenue Growth,https://www.theinformation.com/newsletters/dealmaker/math-behind-anthropics-mad-revenue-growth,2026-04-08 11:05:45
theinformation,,Amazon’s Tough Stance on Prices Prompts Brands to Pull Products,https://www.theinformation.com/articles/amazons-tough-stance-prices-prompts-brands-pull-products,2026-04-08 11:05:45
theinformation,,Anthropic Announces AI Cybersecurity Project Powered By Claude Mythos Model,https://www.theinformation.com/briefings/anthropic-announces-ai-cybersecurity-project-powered-claude-mythos-model,2026-04-08 11:05:45
theinformation,,Microsoft Cloud Exec Joins Anthropic as Head of Infrastructure,https://www.theinformation.com/briefings/microsoft-cloud-exec-joins-anthropic-head-infrastructure,2026-04-08 11:05:45
theinformation,,Anthropic Says It’s Topped $30 Billion in Annualized Revenue,https://www.theinformation.com/briefings/anthropic-says-topped-30-billion-annualized-revenue,2026-04-08 11:05:45
theinformation,,"Musk Seeks to Remove Altman, Brockman from OpenAI Nonprofit",https://www.theinformation.com/briefings/musk-seeks-remove-altman-brockman-openai-nonprofit,2026-04-08 11:05:45
theinformation,,OpenAI Suggests Industrial Policies for Superintelligence,https://www.theinformation.com/briefings/openai-suggests-industrial-policies-superintelligence,2026-04-08 11:05:45
theinformation,,OpenAI Asks Attorneys General to Investigate Musk,https://www.theinformation.com/briefings/openai-asks-attorneys-general-investigate-musk,2026-04-08 11:05:45
theinformation,,Microsoft’s GitHub Sees Booming Traffic—and Outages—as AI Agents Flood Platform,https://www.theinformation.com/newsletters/applied-ai/microsofts-github-sees-booming-traffic-outages-ai-agents-flood-platform,2026-04-08 11:05:45
theinformation,,How Anthropic Could Hit $100 Billion in Annualized Revenue This Year,https://www.theinformation.com/newsletters/dealmaker/anthropic-hit-100-billion-annualized-revenue-year,2026-04-08 11:05:45
theinformation,,Anthropic Signs 3.5 Gigawatt Deal with Broadcom and Google for TPUs,https://www.theinformation.com/briefings/anthropic-signs-3-5-gigawatt-deal-broadcom-google-tpus,2026-04-08 11:05:45
theinformation,,Anthropic’s Compute Crunch Strikes Again,https://www.theinformation.com/newsletters/ai-agenda/anthropics-compute-crunch-strikes,2026-04-08 11:05:45
theinformation,,Why SpaceX Has an Uphill Battle Growing Starlink Mobile - theinformation.com,https://www.theinformation.com/articles/spacex-uphill-battle-growing-starlink-mobile,2026-04-07 10:24:12
theinformation,,Can TensorWave Leapfrog Nvidia’s Big Moat? - theinformation.com,https://www.theinformation.com/newsletters/ai-infrastructure/can-tensorwave-leapfrog-nvidias-big-moat,2026-04-07 10:24:12
theinformation,,OpenAI’s Never-Ending Soap Opera - theinformation.com,https://www.theinformation.com/newsletters/the-briefing/openais-never-ending-soap-opera,2026-04-07 10:24:12
theinformation,,Subscribe to The Information. - theinformation.com,https://www.theinformation.com/subscribe_t,2026-04-07 10:24:12
theinformation,,"Salesforce’s Slack to Stop Direct Service in China, Farm Out to Alibaba",https://www.theinformation.com/briefings/salesforces-slack-stop-direct-service-china-farm-alibaba,2026-04-07 04:38:42
theinformation,,Meta Employees Vie for AI ‘Token Legend’ Status,https://www.theinformation.com/articles/meta-employees-vie-ai-token-legend-status,2026-04-07 04:38:42
theinformation,,OpenAI CFO Questions 2026 IPO Readiness,https://www.theinformation.com/briefings/exclusive-openai-cfo-questions-2026-ipo-readiness,2026-04-07 02:59:01
theinformation,,Codex and Claude Code Can Work Together,https://www.theinformation.com/newsletters/ai-agenda/codex-claude-code-can-work-together,2026-04-07 02:59:01
theinformation,,SpaceX Aims to File for IPO as Soon as This Week,https://www.theinformation.com/articles/spacex-aims-file-ipo-soon-week,2026-04-07 00:46:38
theinformation,,"OpenAI CEO Shifts Responsibilities, Preps ‘Spud’ AI Model",https://www.theinformation.com/articles/openai-ceo-shifts-responsibilities-preps-spud-ai-model,2026-04-07 00:46:38
theinformation,,OpenAI’s First Advertisers Can’t Prove ChatGPT Ads Work,https://www.theinformation.com/articles/openais-first-advertisers-prove-chatgpt-ads-work,2026-04-07 00:46:38
theinformation,,Apple Can ‘Distill’ Google’s Big Gemini Model,https://www.theinformation.com/newsletters/ai-agenda/apple-can-distill-googles-big-gemini-model,2026-04-07 00:46:38
theinformation,,Microsoft Freezes Hiring in Major Cloud and Sales Groups,https://www.theinformation.com/articles/microsoft-freezes-hiring-major-cloud-sales-groups,2026-04-06 23:45:51
theinformation,,Talent Tracker: The Next GPs 2026,https://www.theinformation.com/projects/general-partners-venture-firms-2026,2026-04-06 21:09:44
theinformation,,The ‘For All Mankind’ Showrunners Think They Know What Silicon Valley Likes,https://www.theinformation.com/articles/mankind-showrunners-think-know-silicon-valley-likes,2026-04-06 15:45:23
theinformation,,OpenAI CEO and CFO Diverge on IPO Timing,https://www.theinformation.com/articles/openai-ceo-cfo-diverge-ipo-timing,2026-04-06 08:12:39
theinformation,,Apple Sharply Scales Back Production of Vision Pro,https://www.theinformation.com/articles/apple-sharply-scales-back-production-of-vision-pro,2026-04-06 08:12:39
theinformation,,Salesforce Agentforce Executive Departs for Rival Sierra,https://www.theinformation.com/briefings/salesforce-agentforce-executive-departs-rival-sierra,2026-04-06 08:12:39
theinformation,,"Microsoft Releases AI Models for Transcription, Speech, Image Generation",https://www.theinformation.com/briefings/microsoft-releases-ai-models-transcription-speech-image-generation,2026-04-06 08:12:39
theinformation,,TBPN’s Lovable Underdog Era Ends,https://www.theinformation.com/newsletters/the-weekend/tbpns-lovable-underdog-era-ends,2026-04-06 08:12:39
theinformation,,SpaceX Makes a $75 Billion Offer Investors Can’t Refuse,https://www.theinformation.com/articles/spacex-makes-75-billion-offer-investors-refuse,2026-04-06 08:12:39
theinformation,,Anthropic’s Success Sparks Server Crunch,https://www.theinformation.com/newsletters/ai-agenda/anthropics-success-sparks-server-crunch,2026-04-06 08:12:39
theinformation,,Why OpenAI's TBPN Deal is No Joke,https://www.theinformation.com/newsletters/the-briefing/openais-tbpn-deal-joke,2026-04-06 08:12:39
theinformation,,Amazon’s AI Chat Ads Yield Data but Few Sales,https://www.theinformation.com/articles/amazons-ai-chat-ads-yield-data-sales,2026-04-06 08:12:39
theinformation,,Apple Turns 50 Years Old,https://www.theinformation.com/briefings/apple-turns-50-years-old,2026-04-06 08:12:39
theinformation,,An AI Storytelling Startup is On Pace to Generate $100 Million in Annual Sales,https://www.theinformation.com/newsletters/ai-agenda/ai-storytelling-startup-pace-generate-100-million-annual-sales,2026-04-06 08:12:39
theinformation,,The Vibe Coding Effect? Apple’s App Store Saw 84% Jump in New Apps in Quarter,https://www.theinformation.com/articles/vibe-coding-effect-apples-app-store-saw-84-jump-new-apps-quarter,2026-04-06 08:12:39
theinformation,,SpaceX Said to Submit Confidential Filing for IPO,https://www.theinformation.com/briefings/spacex-said-submit-confidential-filing-ipo,2026-04-06 08:12:39
theinformation,,"Apple Kicks Vibe Coding App Out of App Store, Escalating Crackdown",https://www.theinformation.com/articles/apple-kicks-vibe-coding-app-app-store-escalating-crackdown,2026-04-06 08:12:39
theinformation,,"Frontier Tower, A Hot Spot for Strange Tech, Plots Global Expansion and New Hotel",https://www.theinformation.com/articles/frontier-tower-hot-spot-strange-tech-plots-global-expansion-new-hotel,2026-04-06 08:12:39
theinformation,,"Iran Threats to Attack Microsoft, Google, Oracle in Middle East",https://www.theinformation.com/briefings/iran-threats-attack-microsoft-google-oracle-middle-east,2026-04-06 08:12:39
theinformation,,OpenAI’s Fundraising; The (Dismal) IPO Class of 2021,https://www.theinformation.com/newsletters/the-briefing/openais-fundraising-dismal-ipo-class-2021,2026-04-06 08:12:39
theinformation,,Did Prediction Markets Cause the Crypto Crash?,https://www.theinformation.com/newsletters/the-information-finance/prediction-markets-cause-crypto-crash,2026-04-06 08:12:39
theinformation,,SpaceX Delays Next Starship Test Launch Again,https://www.theinformation.com/briefings/spacex-delays-next-starship-test-launch,2026-04-06 08:12:39
theinformation,,Alibaba’s New Multimodal AI Model is Not Open-Source,https://www.theinformation.com/briefings/alibabas-new-multimodal-ai-model-open-source,2026-04-06 08:12:39
theinformation,,Nvidia Stock is Cheap—What That Signals,https://www.theinformation.com/newsletters/the-briefing/nvidia-stock-cheap-signals,2026-04-06 08:12:39
theinformation,,Jay Edelson Made Facebook Pay. Now He’s Coming for Silicon Valley’s AI,https://www.theinformation.com/articles/jay-edelson-made-facebook-pay-now-coming-silicon-valleys-ai,2026-04-06 08:12:39
theinformation,,Crypto’s Nasty Downturn Is Getting Worse,https://www.theinformation.com/articles/cryptos-nasty-downturn-getting-worse,2026-04-06 08:12:39
theinformation,,Apple Temporarily Launches AI Software in China,https://www.theinformation.com/briefings/apple-temporarily-launches-ai-software-china,2026-04-06 08:12:39
theinformation,,Big Tech Schools Big Energy on Powering AI,https://www.theinformation.com/newsletters/ai-infrastructure/big-tech-schools-big-energy-powering-ai,2026-04-06 08:12:39
theinformation,,Nasdaq Rule Change Would Speed Index Entry for SpaceX IPO,https://www.theinformation.com/briefings/nasdaq-rule-change-speed-index-entry-spacex-ipo,2026-04-06 08:12:39
theinformation,,"Chinese Humanoid Maker Agibot Rolls Out 10,000th Mass-Produced Unit",https://www.theinformation.com/briefings/chinese-humanoid-maker-agibot-rolls-10-000th-mass-produced-unit,2026-04-06 08:12:39
theinformation,,SpaceX Hype Boosts Stocks in Its Crosshairs,https://www.theinformation.com/articles/spacex-hype-boosts-stocks-crosshairs,2026-04-06 08:12:39
theinformation,,Anthropic Discusses Going Public as Soon as the Fourth Quarter,https://www.theinformation.com/articles/anthropic-discusses-going-public-soon-fourth-quarter,2026-04-06 08:12:39
theinformation,,OpenAI Surpasses $100 Million Annualized Revenue From Ads Pilot,https://www.theinformation.com/briefings/exclusive-openai-surpasses-100-million-annualized-revenue-ads-pilot,2026-04-06 08:12:39
theinformation,,Claude is Gaining on OpenClaw,https://www.theinformation.com/newsletters/ai-agenda/claude-gaining-openclaw,2026-04-06 08:12:39
theinformation,,What the Coming Big IPOs Mean for Tech Stocks,https://www.theinformation.com/newsletters/the-briefing/coming-big-ipos-mean-tech-stocks,2026-04-06 06:36:19
theinformation,,Software Under Siege: Enterprise AI Report Card,https://www.theinformation.com/articles/software-siege-enterprise-ai-report-card,2026-04-06 06:36:19
theinformation,,AI Is Weighing on the Software Debt Market,https://www.theinformation.com/articles/ai-weighing-software-debt-market,2026-04-06 06:36:19
theinformation,,The Team,https://www.theinformation.com/about,2026-04-06 06:36:19
theinformation,,DeepSeek’s New AI Model Will Be a Victory for Huawei,https://www.theinformation.com/articles/deepseeks-new-ai-model-will-victory-huawei,2026-04-05 18:46:39
theinformation,,Anthropic Acquires Startup Coefficient Bio for About $400 Million,https://www.theinformation.com/articles/anthropic-acquires-startup-coefficient-bio-400-million,2026-04-05 18:46:39
theinformation,,Why OpenAI’s Fidji Simo Bought the TBPN Podcast Amid Crusade Against ‘Side Quests’,https://www.theinformation.com/articles/openais-fidji-simo-bought-tbpn-podcast-amid-crusade-side-quests,2026-04-05 18:46:39
theinformation,,Amazon Curbs Misleading Markdowns Ahead of Prime Day Sale,https://www.theinformation.com/articles/amazon-curbs-misleading-markdowns-ahead-prime-day-sale,2026-04-05 18:46:39
theinformation,,Tether Makes Final Push for Fundraising at $500 Billion Valuation,https://www.theinformation.com/articles/tether-makes-final-push-fundraising-500-billion-valuation,2026-04-05 18:46:39
theinformation,,Anthropic’s Coding Agent Source Code Exposed in Leak,https://www.theinformation.com/briefings/anthropics-coding-agent-source-code-exposed-leak,2026-04-05 18:46:39
theinformation,,Anthropic ‘Mythos’ Model Signals New Era of AI Cybersecurity Risks,https://www.theinformation.com/newsletters/applied-ai/anthropic-mythos-model-signals-new-era-ai-cybersecurity-risks,2026-04-05 18:46:39
theinformation,,"For Blackstone, Private Credit Fears Miss the Big Picture",https://www.theinformation.com/articles/blackstone-private-credit-fears-miss-big-picture,2026-04-05 18:46:39
theinformation,,Amazon in Talks to Acquire Globalstar,https://www.theinformation.com/briefings/amazon-talks-acquire-globalstar,2026-04-05 18:46:39
theinformation,,Mixed OpenAI Investor Signals,https://www.theinformation.com/newsletters/the-briefing/mixed-openai-investor-signals,2026-04-05 18:46:39
theinformation,,Database Startup Supabase in Talks to Double Valuation to $10 Billion,https://www.theinformation.com/articles/database-startup-supabase-talks-double-valuation-10-billion,2026-04-05 18:46:39
theinformation,,Claude Code Leak Reveals Always-On ‘Kairos’ Agent,https://www.theinformation.com/newsletters/ai-agenda/claude-code-leak-reveals-always-kairos-agent,2026-04-05 18:46:39
theinformation,,"OpenAI Apps Chief To Take a Short Medical Leave, Announces Broader Reorganization",https://www.theinformation.com/briefings/openais-simo-take-several-weeks-medical-break,2026-04-05 18:46:39
theinformation,,"Microsoft Debuts New Copilot Upgrades Combining Anthropic, OpenAI Models",https://www.theinformation.com/briefings/microsoft-debuts-new-copilot-upgrades-combining-anthropic-openai-models,2026-04-05 18:46:39
theinformation,,"Microsoft Hit Copilot Sales Goals in March Quarter, Commercial CEO Tells Staff",https://www.theinformation.com/briefings/microsoft-hit-copilot-sales-goals-march-quarter-commercial-ceo-tells-staff,2026-04-05 18:46:39
theinformation,,Washington State Sues Kalshi,https://www.theinformation.com/briefings/washington-state-sues-kalshi,2026-04-05 18:46:39
theinformation,,Startup That Helps Developers Pick AI Models Nears $1.3 Billion Valuation,https://www.theinformation.com/articles/startup-helps-developers-pick-ai-models-nears-1-3-billion-valuation,2026-04-05 18:46:39
theinformation,,OpenAI’s Fidji Simo Pushes Company to Stay Out of Social Media,https://www.theinformation.com/briefings/openais-fidji-simo-pushes-company-stay-social-media,2026-04-05 18:46:39
theinformation,,OpenAI Buys ‘TBPN',https://www.theinformation.com/briefings/openai-buys-tbpn,2026-04-05 18:46:39
theinformation,,Alibaba Launches Another Closed-Source AI Model,https://www.theinformation.com/briefings/alibaba-launches-another-closed-source-ai-model,2026-04-05 18:46:39
