domain,company,title,url,crawled_at
thelec,,Genesem Secures Orders From Three Major Indian Semiconductor Packaging Customers,http://www.thelec.net/news/articleView.html?idxno=6378,2026-04-08 08:02:50
thelec,,"LG Electronics Returns to Profit in First Quarter, Posts Record Revenue",http://www.thelec.net/news/articleView.html?idxno=6396,2026-04-08 07:07:06
thelec,,IVWorks Targets Kosdaq IPO After Securing GaN Wafer Customers,http://www.thelec.net/news/articleView.html?idxno=6410,2026-04-08 07:07:06
thelec,,LG Energy Solution Reports 207.8 Billion Won Operating Loss in First Quarter,http://www.thelec.net/news/articleView.html?idxno=6412,2026-04-08 07:07:06
thelec,,Top Material Wins 7.9 Billion Won Turnkey Battery Line Order From Türkiye's ASPİLSAN,http://www.thelec.net/news/articleView.html?idxno=6371,2026-04-08 07:07:06
thelec,,Wonik D2I Begins Shipments of Mobile OLED Display Driver ICs,http://www.thelec.net/news/articleView.html?idxno=6367,2026-04-08 07:07:06
thelec,,DI to Invest 53 Billion Won in ASIC-Based High-Frequency DRAM Testers,http://www.thelec.net/news/articleView.html?idxno=6363,2026-04-07 21:18:44
thelec,,Samsung Electronics Reports Record 57.2 Trillion Won Operating Profit for First Quarter,http://www.thelec.net/news/articleView.html?idxno=6384,2026-04-07 21:18:44
thelec,,Samsung Electronics Eyes 300 Trillion Won Annual Profit After Record Q1,http://www.thelec.net/news/articleView.html?idxno=6385,2026-04-07 21:18:44
thelec,,ADTechnology Targets AI-RAN CPU Market With 2-Nanometer Project,http://www.thelec.net/news/articleView.html?idxno=6397,2026-04-07 21:18:44
thelec,,FADU Debt Ratio Jumps to 521% Amid Investment in Sixth-Generation SSD Controllers,http://www.thelec.net/news/articleView.html?idxno=6373,2026-04-07 21:18:44
thelec,,Toprun Total Solution Wins CMS Order From BOE Affiliate in China,http://www.thelec.net/news/articleView.html?idxno=6399,2026-04-07 21:18:44
thelec,,Chinese Cathode Supplier to LG Energy Solution Restructures to Meet U.S. IRA Rules,http://www.thelec.net/news/articleView.html?idxno=6404,2026-04-07 21:18:44
thelec,,"Siemens, Nvidia Unveil AI Chip Verification Solution Capable of Trillions of Cycles in Days",http://www.thelec.net/news/articleView.html?idxno=6368,2026-04-07 18:42:55
thelec,,"Smilegate STOVE Emerges as Indie Game Hub With 3,500 Titles",http://www.thelec.net/news/articleView.html?idxno=6372,2026-04-07 18:42:55
thelec,,LG CNS to Lead Phase 2 of 'Project Hangang' on Deposit Tokens for Government Subsidies,http://www.thelec.net/news/articleView.html?idxno=6374,2026-04-07 18:42:55
thelec,,Netmarble to Buy 150 Billion Won More in Coway Shares Over One Year,http://www.thelec.net/news/articleView.html?idxno=6375,2026-04-07 18:42:55
thelec,,GITSN Installs Illegal Filming Detection System at Seoul Arts Center Opera House,http://www.thelec.net/news/articleView.html?idxno=6376,2026-04-07 18:42:55
thelec,,"Intellivix, Sungkyunkwan University Partner on Defense AI Transformation Development",http://www.thelec.net/news/articleView.html?idxno=6379,2026-04-07 18:42:55
thelec,,OutSystems Unveils Agentic Systems Engineering for AI Agent Governance and Development,http://www.thelec.net/news/articleView.html?idxno=6380,2026-04-07 18:42:55
thelec,,WebearSoft Signs Deal to Supply Certificate Automation Solution to Heungkuk Fire & Marine Insurance,http://www.thelec.net/news/articleView.html?idxno=6382,2026-04-07 18:42:55
thelec,,Samsung SDS Selected to Build AI Agent Banking System for Woori Bank by August 2027,http://www.thelec.net/news/articleView.html?idxno=6386,2026-04-07 18:42:55
thelec,,"LG Uplus, IBK Systems Sign MOU to Develop AI Services for Financial Sector",http://www.thelec.net/news/articleView.html?idxno=6387,2026-04-07 18:42:55
thelec,,"Genians Surpasses 200 Global Customers, With U.S. Leading Overseas Revenue",http://www.thelec.net/news/articleView.html?idxno=6388,2026-04-07 18:42:55
thelec,,YoungLimWon Soft Lab Completes ERP Deployment for Poongjeon Nonferrous Metal,http://www.thelec.net/news/articleView.html?idxno=6389,2026-04-07 18:42:55
thelec,,MegazoneCloud Returns to Profit With 1.75 Trillion Won in Annual Revenue,http://www.thelec.net/news/articleView.html?idxno=6390,2026-04-07 18:42:55
thelec,,"Oracle Launches AI Database@AWS in South Korea, Expanding to Seoul Region",http://www.thelec.net/news/articleView.html?idxno=6391,2026-04-07 18:42:55
thelec,,NHN Cloud Signs MOU to Support AI SMEs in Honam Region,http://www.thelec.net/news/articleView.html?idxno=6392,2026-04-07 18:42:55
thelec,,Naver Signs MOU With EBS to Develop Knowledge Content for AI Search,http://www.thelec.net/news/articleView.html?idxno=6395,2026-04-07 18:42:55
thelec,,"Sam Chun Dang Pharm CEO Explains Block Deal Withdrawal, Addresses Technology Concerns",http://www.thelec.net/news/articleView.html?idxno=6383,2026-04-07 12:58:26
thelec,,Korea Display Industry Eyes Access to 150 Trillion Won National Growth Fund,http://www.thelec.net/news/articleView.html?idxno=6377,2026-04-07 12:58:26
thelec,,Shinsung E&G to Showcase FFU-Based Cleanroom Solutions at Air Fair 2026,http://www.thelec.net/news/articleView.html?idxno=6360,2026-04-07 12:58:26
thelec,,SEC Selected for Government R&D Project on Electron Beam Sterilization System,http://www.thelec.net/news/articleView.html?idxno=6357,2026-04-07 12:58:26
thelec,,Hanwha Chairman Kim Seung-youn Attends Bukil High School 50th Anniversary Event,http://www.thelec.net/news/articleView.html?idxno=6354,2026-04-07 12:58:26
thelec,,"LS Electric to Launch Next-Generation PLC for Hyundai, Kia Production Lines in July",http://www.thelec.net/news/articleView.html?idxno=6364,2026-04-07 12:58:26
thelec,,"BOE Enters Sample Verification Stage for Gen 8.6 OLED Line, Targets Mass Production in 2H",http://www.thelec.net/news/articleView.html?idxno=6356,2026-04-07 12:58:26
thelec,,HS Hyosung Advanced Materials Cancels Sale of Steel Cord Business,http://www.thelec.net/news/articleView.html?idxno=6352,2026-04-07 12:58:26
thelec,,Hanwha Solutions Retracts Comments on Regulator Talks Over Rights Offering,http://www.thelec.net/news/articleView.html?idxno=6353,2026-04-07 12:58:26
thelec,,LG Uplus to Double Data Allowance for Roaming Pass Plans From May 1,http://www.thelec.net/news/articleView.html?idxno=6361,2026-04-07 12:58:26
thelec,,Samchundang Pharm Withdraws Plan to Sell 250 Billion Won Block Deal,http://www.thelec.net/news/articleView.html?idxno=6359,2026-04-07 12:58:26
thelec,,LS Electric Wins $70.26 Million Order for Ultra-High Voltage Transformers in U.S. Data Center Project,http://www.thelec.net/news/articleView.html?idxno=6358,2026-04-07 12:58:26
thelec,,"Google Unveils Gemma 4 With Apache 2.0 License, Boosts Open Model Strategy",http://www.thelec.net/news/articleView.html?idxno=6355,2026-04-07 12:58:26
thelec,,"Sungdo Engineering & Construction Loses Final Appeal in SK hynix Wuxi Fire Lawsuit, Faces 16.6 Billion Won Liability",http://www.thelec.net/news/articleView.html?idxno=6348,2026-04-07 12:58:26
thelec,,"LG Chem Signs Deal to Market Endometriosis Drug in Korea, Thailand",http://www.thelec.net/news/articleView.html?idxno=6347,2026-04-07 12:58:26
thelec,,Avaco Expands Into Semiconductor Equipment From Display and Battery Roots,http://www.thelec.net/news/articleView.html?idxno=6333,2026-04-07 12:58:26
thelec,,Samsung Display Union Surpasses Majority Membership,http://www.thelec.net/news/articleView.html?idxno=6346,2026-04-07 12:58:26
thelec,,Laserssel to Issue 1 Billion Won Convertible Bonds for Raw Material Procurement,http://www.thelec.net/news/articleView.html?idxno=6350,2026-04-07 12:58:26
thelec,,Novo Nordisk Highlights Superiority of Oral Wegovy in Indirect Comparison Study,http://www.thelec.net/news/articleView.html?idxno=6349,2026-04-07 12:58:26
thelec,,Hanwha Solutions Says No Additional Equity Issuance Planned Through 2030,http://www.thelec.net/news/articleView.html?idxno=6338,2026-04-07 12:58:26
thelec,,Privacy Display Smartphone Shipments Seen Surging to 21 Million in 2026,http://www.thelec.net/news/articleView.html?idxno=6332,2026-04-07 12:58:26
thelec,,"MegazoneCloud Highlights Governance, Security as Core to AI Deployment",http://www.thelec.net/news/articleView.html?idxno=6331,2026-04-07 12:58:26
thelec,,"Younglimwon Soft Lab, Human Consulting Group Partner on ERP-HR Integration",http://www.thelec.net/news/articleView.html?idxno=6330,2026-04-07 12:58:26
thelec,,Dongwha Electrolyte Secures National Strategic Technology Status for Battery Additive,http://www.thelec.net/news/articleView.html?idxno=6328,2026-04-07 12:58:26
thelec,,LG Energy Solution Becomes First Battery Maker to Join SDVerse Vehicle Software Platform,http://www.thelec.net/news/articleView.html?idxno=6327,2026-04-07 12:58:26
thelec,,"Posco, Ecopro Lead Battery Materials Sector as Peers Struggle",http://www.thelec.net/news/articleView.html?idxno=6335,2026-04-07 12:58:26
thelec,,"SK Telecom Co., Ltd. Expands 6G Strategy Through AI-RAN Partnerships",http://www.thelec.net/news/articleView.html?idxno=6344,2026-04-07 12:58:26
thelec,,LG Innotek Expands 'Eye Dream Up' CSR Program to Vietnam,http://www.thelec.net/news/articleView.html?idxno=6343,2026-04-07 12:58:26
thelec,,Hyundai Rotem to Join Army Unmanned Vehicle Evaluation After Delay,http://www.thelec.net/news/articleView.html?idxno=6342,2026-04-07 12:58:26
thelec,,"Samsung Electronics Names KCTech, Wonik IPS Among Top Suppliers at 2026 Partner Day",http://www.thelec.net/news/articleView.html?idxno=6340,2026-04-07 12:58:26
thelec,,Samsung Biologics Union Plans Labor Complaint Amid Strike Dispute,http://www.thelec.net/news/articleView.html?idxno=6339,2026-04-07 12:58:26
thelec,,Genians Expands Middle East Footprint as EMEA Accounts for 46% of Overseas Clients,http://www.thelec.net/news/articleView.html?idxno=6336,2026-04-07 12:58:26
thelec,,JoyCity to Launch MMORPG 'Imjin War: Joseon's Counterattack' on April 28,http://www.thelec.net/news/articleView.html?idxno=6329,2026-04-07 12:58:26
thelec,,"OpenAI Raises $122 Billion, but Wall Street Flags Risks",http://www.thelec.net/news/articleView.html?idxno=6326,2026-04-07 12:58:26
thelec,,Hanmi Pharmaceutical CEO Hwang Sang-yeon Visits Production Sites in First Official Move,http://www.thelec.net/news/articleView.html?idxno=6323,2026-04-07 12:58:26
thelec,,DEEPX Expands NPU Partnership With Lotte Innovate After PoC Approval,http://www.thelec.net/news/articleView.html?idxno=6322,2026-04-07 12:58:26
thelec,,KT Accelerates Affiliate CEO Appointments Following Leadership Reshuffle,http://www.thelec.net/news/articleView.html?idxno=6321,2026-04-07 12:58:26
thelec,,AUROS Technology Targets Mass Supply of 1nm-Level Metrology Tools This Year,http://www.thelec.net/news/articleView.html?idxno=6318,2026-04-07 12:58:26
thelec,,Samsung SDS Highlights 'Agentic AI' as Next Phase of Supply Chain Innovation,http://www.thelec.net/news/articleView.html?idxno=6317,2026-04-07 12:58:26
thelec,,"LG Uplus, LG Electronics Begin Research on 6G Semantic Communications and PQC",http://www.thelec.net/news/articleView.html?idxno=6316,2026-04-07 12:58:26
thelec,,POSCO DX Partners With Mobilint to Deploy NPU-Based Smart Factory Systems,http://www.thelec.net/news/articleView.html?idxno=6314,2026-04-07 12:58:26
thelec,,Qualcomm Joins Korea's 'Challenge AX' Program to Support AI Startups,http://www.thelec.net/news/articleView.html?idxno=6309,2026-04-07 12:58:26
thelec,,LG Chairman Koo Kwang-mo Emphasizes Integrated ESS Solutions Strategy,http://www.thelec.net/news/articleView.html?idxno=6308,2026-04-07 12:58:26
thelec,,Korea Zinc Launches U.S. Smelter Project 'Project Crucible',http://www.thelec.net/news/articleView.html?idxno=6306,2026-04-07 12:58:26
thelec,,Samsung Electronics Leads Global Gaming Monitor Market for Seventh Straight Year,http://www.thelec.net/news/articleView.html?idxno=6304,2026-04-07 12:58:26
thelec,,HS Hyosung Appoints Kim Kyu-young as Chairman in Shift to Professional Management,http://www.thelec.net/news/articleView.html?idxno=6300,2026-04-07 12:58:26
thelec,,LG Chem Signs Exclusive License Deal for Oncology Drug Targeting p53 Mutation,http://www.thelec.net/news/articleView.html?idxno=6299,2026-04-07 12:58:26
thelec,,Celltrion Cancels 9.11 Million Treasury Shares Worth 1.7154 Trillion Won,http://www.thelec.net/news/articleView.html?idxno=6298,2026-04-07 12:58:26
thelec,,Samsung Biologics Completes Acquisition of U.S. Biologics Manufacturing Facility,http://www.thelec.net/news/articleView.html?idxno=6297,2026-04-07 12:58:26
thelec,,LOTTE BIOLOGICS Signs CDMO Deal With U.S. Oncology Biotech Company,http://www.thelec.net/news/articleView.html?idxno=6296,2026-04-07 12:58:26
